"qudtUri","qudtLabel","qudtDimensionVector","qudtConversionMultiplier","nonLatexDescription","latexDescription"
"http://qudt.org/2.1/vocab/unit","QUDT VOCAB Units of Measure Release 2.1.27",NA,NA,NA,NA
"http://qudt.org/vocab/unit/A","Ampere","http://qudt.org/vocab/dimensionvector/A0E1L0I0M0H0T0D0",1,NA,"The  \(\textit{ampere}\), often shortened to \(\textit{amp}\), is the SI unit of electric current and is one of the seven SI base units.
\(\text{A}\ \equiv\ \text{amp (or ampere)}\ \equiv\ \frac{\text{C}}{\text{s}}\ \equiv\ \frac{\text{coulomb}}{\text{second}}\ \equiv\ \frac{\text{J}}{\text{Wb}}\ \equiv\ \frac{\text{joule}}{\text{weber}}\)
Note that SI supports only the use of symbols and deprecates the use of any abbreviations for units."
"http://qudt.org/vocab/unit/A-HR","Ampere Hour","http://qudt.org/vocab/dimensionvector/A0E1L0I0M0H0T1D0",3600,NA,"\(\textbf{Ampere hour}\) is a practical unit of electric charge equal to the charge flowing in one hour through a conductor passing one ampere. An ampere-hour or amp-hour (symbol \(Ah,\,AHr,\, A \cdot h, A h\)) is a unit of electric charge, with sub-units milliampere-hour (\(mAh\)) and milliampere second (\(mAs\)). One ampere-hour is equal to 3600 coulombs (ampere-seconds), the electric charge transferred by a steady current of one ampere for one hour. The ampere-hour is frequently used in measurements of electrochemical systems such as electroplating and electrical batteries. The commonly seen milliampere-hour (\(mAh\) or \(mA \cdot h\)) is one-thousandth of an ampere-hour (\(3.6 \,coulombs\))."
"http://qudt.org/vocab/unit/A-M2","Ampere Square Meter","http://qudt.org/vocab/dimensionvector/A0E1L2I0M0H0T0D0",1,"The SI unit of electromagnetic moment.",NA
"http://qudt.org/vocab/unit/A-M2-PER-J-SEC","Ampere Square Meter Per Joule Second","http://qudt.org/vocab/dimensionvector/A0E1L0I0M-1H0T1D0",1,"The SI unit of gyromagnetic ratio.",NA
"http://qudt.org/vocab/unit/A-PER-CentiM","Ampere Per Centimeter","http://qudt.org/vocab/dimensionvector/A0E1L-1I0M0H0T0D0",100,NA,NA
"http://qudt.org/vocab/unit/A-PER-CentiM2","Ampere Per Square Centimeter","http://qudt.org/vocab/dimensionvector/A0E1L-2I0M0H0T0D0",10000,NA,NA
"http://qudt.org/vocab/unit/A-PER-DEG_C","Ampere per Degree Celsius","http://qudt.org/vocab/dimensionvector/A0E1L0I0M0H-1T0D0",57.2957795,"A measure used to express how a current is subject to temperature. Originally used in Wien's Law to describe phenomena related to filaments. One use today is to express how a current generator derates with temperature.",NA
"http://qudt.org/vocab/unit/A-PER-GM","Ampere per Gram","http://qudt.org/vocab/dimensionvector/A0E1L0I0M-1H0T0D0",1000,NA,"\(\textbf{Ampere per gram}\) is a practical unit to describe an (applied) current relative to the involved amount of material. This unit is often found in electrochemistry to standardize test conditions and compare various scales of investigated materials."
"http://qudt.org/vocab/unit/A-PER-J","Ampere per Joule","http://qudt.org/vocab/dimensionvector/A0E1L-2I0M-1H0T3D0",1,NA,"The inverse measure of \(joule-per-ampere\) or \(weber\). The measure for the reciprical of magnetic flux."
"http://qudt.org/vocab/unit/A-PER-M","Ampere per Meter","http://qudt.org/vocab/dimensionvector/A0E1L-1I0M0H0T0D0",1,NA,"is the SI unit of magnetic field strength. One ampere per meter is equal to \(\pi/250\) oersteds (\(12.566\, 371\,millioersteds\)) in CGS units. The ampere per meter is also the SI unit of ""magnetization"" in the sense of magnetic dipole moment per unit volume; in this context \(1 A/m = 0.001\,emu\,per\,cubic\,centimeter\)."
"http://qudt.org/vocab/unit/A-PER-M2","Ampere per Square Meter","http://qudt.org/vocab/dimensionvector/A0E1L-2I0M0H0T0D0",1,NA,"\(\textbf{Ampere Per Square Meter}\) is a unit in the category of electric current density. This unit is commonly used in the SI unit system."
"http://qudt.org/vocab/unit/A-PER-M2-K2","Ampere per Square Meter Square Kelvin","http://qudt.org/vocab/dimensionvector/A0E1L-2I0M0H-2T0D0",1,NA,NA
"http://qudt.org/vocab/unit/A-PER-MilliM","Ampere Per Millimeter","http://qudt.org/vocab/dimensionvector/A0E1L-1I0M0H0T0D0",1000,NA,NA
"http://qudt.org/vocab/unit/A-PER-MilliM2","Ampere Per Square Millimeter","http://qudt.org/vocab/dimensionvector/A0E1L-2I0M0H0T0D0",1e+06,NA,NA
"http://qudt.org/vocab/unit/A-PER-RAD","Ampere per Radian","http://qudt.org/vocab/dimensionvector/A0E1L0I0M0H0T0D0",1,NA,"\(\textit{Ampere per Radian}\) is a derived unit for measuring the amount of current per unit measure of angle, expressed in ampere per radian."
"http://qudt.org/vocab/unit/A-SEC","Ampere Second","http://qudt.org/vocab/dimensionvector/A0E1L0I0M0H0T1D0",1,NA,NA
"http://qudt.org/vocab/unit/A_Ab","Abampere","http://qudt.org/vocab/dimensionvector/A0E1L0I0M0H0T0D0",10,NA,NA
"http://qudt.org/vocab/unit/A_Ab-CentiM2","Abampere Square centimeter","http://qudt.org/vocab/dimensionvector/A0E2L-3I0M-1H0T3D0",1e+09,"""Abampere Square centimeter"" is the unit of magnetic moment in the electromagnetic centimeter-gram-second system.",NA
"http://qudt.org/vocab/unit/A_Ab-PER-CentiM2","Abampere per Square Centimeter","http://qudt.org/vocab/dimensionvector/A0E1L-2I0M0H0T0D0",1e+05,NA,"Abampere Per Square Centimeter (\(aA/cm^2\)) is a unit in the category of Electric current density. It is also known as abamperes per square centimeter, abampere/square centimeter, abampere/square centimetre, abamperes per square centimetre, abampere per square centimetre. This unit is commonly used in the cgs unit system. Abampere Per Square Centimeter (\(aA/cm^2\)) has a dimension of \(L^{-2}I\) where L is length, and I is electric current. It can be converted to the corresponding standard SI unit \(A/m^{2}\) by multiplying its value by a factor of 100000."
"http://qudt.org/vocab/unit/A_Stat","Statampere","http://qudt.org/vocab/dimensionvector/A0E1L0I0M0H0T0D0",3.335641e-10,"""Statampere"" (statA) is a unit in the category of Electric current. It is also known as statamperes. This unit is commonly used in the cgs unit system. Statampere (statA) has a dimension of I where I is electric current. It can be converted to the corresponding standard SI unit A by multiplying its value by a factor of 3.355641E-010.",NA
"http://qudt.org/vocab/unit/A_Stat-PER-CentiM2","Statampere per Square Centimeter","http://qudt.org/vocab/dimensionvector/A0E1L-2I0M0H0T0D0",3.335641e-06,"The Statampere per Square Centimeter is a unit of electric current density in the c.g.s. system of units.",NA
"http://qudt.org/vocab/unit/AC","Acre","http://qudt.org/vocab/dimensionvector/A0E0L2I0M0H0T0D0",4046.8564224,"The acre is a unit of area in a number of different systems, including the imperial and U.S. customary systems. Its international symbol is ac. The most commonly used acres today are the international acre and, in the United States, the survey acre. The most common use of the acre is to measure tracts of land. One international acre is equal to 4046.8564224 square metres.",NA
"http://qudt.org/vocab/unit/AC-FT","Acre Foot","http://qudt.org/vocab/dimensionvector/A0E0L3I0M0H0T0D0",1233.48183754752,NA,"An acre-foot is a unit of volume commonly used in the United States in reference to large-scale water resources, such as reservoirs, aqueducts, canals, sewer flow capacity, and river flows. It is defined by the volume of one acre of surface area to a depth of one foot. Since the acre is defined as a chain by a furlong (\(66 ft \times 660 ft\)) the acre-foot is exactly \(43,560 cubic feet\). For irrigation water, the volume of \(1 ft \times 1 \; ac = 43,560 \; ft^{3} (1,233.482 \; m^{3}, 325,851 \; US gal)\)."
"http://qudt.org/vocab/unit/AMU","Atomic mass unit","http://qudt.org/vocab/dimensionvector/A0E0L0I0M1H0T0D0",0,NA,"The \(\textit{Unified Atomic Mass Unit}\) (symbol: \(\mu\)) or \(\textit{dalton}\) (symbol: Da) is a unit that is used for indicating mass on an atomic or molecular scale. It is defined as one twelfth of the rest mass of an unbound atom of carbon-12 in its nuclear and electronic ground state, and has a value of \(1.660538782(83) \times 10^{-27} kg\).  One \(Da\) is approximately equal to the mass of one proton or one neutron. The CIPM have categorised it as a \(\textit{""non-SI unit whose values in SI units must be obtained experimentally""}\)."
"http://qudt.org/vocab/unit/ANGSTROM","Angstrom","http://qudt.org/vocab/dimensionvector/A0E0L1I0M0H0T0D0",1e-10,NA,"The \(Angstr\ddot{o}m\) is an internationally recognized unit of length equal to \(0.1 \,nanometre\) or \(1 \times 10^{-10}\,metres\).  Although accepted for use, it is not formally defined within the International System of Units(SI). The angstrom is often used in the natural sciences to express the sizes of atoms, lengths of chemical bonds and the wavelengths of electromagnetic radiation, and in technology for the dimensions of parts of integrated circuits. It is also commonly used in structural biology."
"http://qudt.org/vocab/unit/ANGSTROM3","Cubic Angstrom","http://qudt.org/vocab/dimensionvector/A0E0L3I0M0H0T0D0",0,NA,"A unit that is a non-SI unit, specifically a CGS unit,  of polarizability known informally as polarizability volume.  The SI defined units for polarizability are C*m^2/V and can be converted to \(Angstr\ddot{o}m\)^3 by multiplying the SI value by 4 times pi times the vacuum permittivity and then converting the resulting m^3 to \(Angstr\ddot{o}m\)^3 through the SI base 10 conversion (multiplying by 10^-30)."
"http://qudt.org/vocab/unit/ARCMIN","ArcMinute","http://qudt.org/vocab/dimensionvector/A0E0L0I0M0H0T0D1",0.000290888209,NA,"A minute of arc, arcminute, or minute arc (MOA), is a unit of angular measurement equal to one sixtieth (1/60) of one degree (circle/21,600), or \(\pi /10,800 radians\). In turn, a second of arc or arcsecond is one sixtieth (1/60) of one minute of arc. Since one degree is defined as one three hundred and sixtieth (1/360) of a rotation, one minute of arc is 1/21,600 of a rotation."
"http://qudt.org/vocab/unit/ARCSEC","ArcSecond","http://qudt.org/vocab/dimensionvector/A0E0L0I0M0H0T0D1",4.84813681e-06,NA,"""Arc Second"" is a unit of angular measure, also called the \(\textit{second of arc}\), equal to \(1/60 \; arcminute\). One arcsecond is a very small angle: there are 1,296,000 in a circle. The SI recommends \(\textit{double prime}\) (\(''\)) as the symbol for the arcsecond. The symbol has become common in astronomy, where very small angles are stated in milliarcseconds (\(mas\))."
"http://qudt.org/vocab/unit/ARE","are","http://qudt.org/vocab/dimensionvector/A0E0L2I0M0H0T0D0",100,"An 'are' is a unit of area equal to 0.02471 acre and 100 centare.",NA
"http://qudt.org/vocab/unit/AT","Ampere Turn","http://qudt.org/vocab/dimensionvector/A0E1L0I0M0H0T0D0",1,NA,"The \(\textit{ampere-turn}\) was the MKS unit of magnetomotive force (MMF), represented by a direct current of one ampere flowing in a single-turn loop in a vacuum. ""Turns"" refers to the winding number of an electrical conductor comprising an inductor. The ampere-turn was replaced by the SI unit, \(ampere\)."
"http://qudt.org/vocab/unit/AT-PER-IN","Ampere Turn per Inch","http://qudt.org/vocab/dimensionvector/A0E1L-1I0M0H0T0D0",39.3700787,"The \(\textit{Ampere Turn per Inch}\) is a measure of magnetic field intensity and is eual to 12.5664 Oersted.",NA
"http://qudt.org/vocab/unit/AT-PER-M","Ampere Turn per Meter","http://qudt.org/vocab/dimensionvector/A0E1L-1I0M0H0T0D0",1,NA,"The  \(\textit{Ampere Turn per Metre}\) is the SI unit of magnetic field strength. One ampere per meter is equal to \(\pi/250\) oersteds (12.566 371 millioersteds) in CGS units. The ampere per meter is also the SI unit of ""magnetization"" in the sense of magnetic dipole moment per unit volume; in this context \(1 A/m = 0.001 emu per cubic centimeter\)."
"http://qudt.org/vocab/unit/ATM","Standard Atmosphere","http://qudt.org/vocab/dimensionvector/A0E0L-1I0M1H0T-2D0",101325,NA,"The standard atmosphere (symbol: atm) is an international reference pressure defined as \(101.325 \,kPa\) and formerly used as unit of pressure. For practical purposes it has been replaced by the bar which is \(100 kPa\). The difference of about 1% is not significant for many applications, and is within the error range of common pressure gauges."
"http://qudt.org/vocab/unit/ATM-M3-PER-MOL","Atmosphere Cubic Meter per Mole","http://qudt.org/vocab/dimensionvector/A-1E0L2I0M1H0T-2D0",101325,NA,"A unit that consists of the power of the SI base unit metre with the exponent 3 multiplied by the unit atmosphere divided by the SI base unit mol."
"http://qudt.org/vocab/unit/ATM_T","Technical Atmosphere","http://qudt.org/vocab/dimensionvector/A0E0L-1I0M1H0T-2D0",98066.5,NA,"A technical atmosphere (symbol: at) is a non-SI unit of pressure equal to one kilogram-force per square centimeter. The symbol 'at' clashes with that of the katal (symbol: 'kat'), the SI unit of catalytic activity; a kilotechnical atmosphere would have the symbol 'kat', indistinguishable from the symbol for the katal. It also clashes with that of the non-SI unit, the attotonne, but that unit would be more likely be rendered as the equivalent SI unit. Assay ton (abbreviation 'AT') is not a unit of measurement, but a standard quantity used in assaying ores of precious metals; it is \(29 1D6 \,grams\) (short assay ton) or \(32 2D3 \,grams\) (long assay ton), the amount which bears the same ratio to a milligram as a short or long ton bears to a troy ounce. In other words, the number of milligrams of a particular metal found in a sample of this size gives the number of troy ounces contained in a short or long ton of ore."
"http://qudt.org/vocab/unit/AttoC","AttoCoulomb","http://qudt.org/vocab/dimensionvector/A0E1L0I0M0H0T1D0",0,NA,"An AttoColomb is \(10^{-18} C\)."
"http://qudt.org/vocab/unit/AttoFARAD","Attofarad","http://qudt.org/vocab/dimensionvector/A0E2L-2I0M-1H0T4D0",0,NA,NA
"http://qudt.org/vocab/unit/AttoJ","Attojoule","http://qudt.org/vocab/dimensionvector/A0E0L2I0M1H0T-2D0",0,NA,NA
"http://qudt.org/vocab/unit/AttoJ-SEC","Attojoule Second","http://qudt.org/vocab/dimensionvector/A0E0L2I0M1H0T-1D0",0,NA,NA
"http://qudt.org/vocab/unit/AU","astronomical-unit","http://qudt.org/vocab/dimensionvector/A0E0L1I0M0H0T0D0",149597870691.6,NA,"An astronomical unit (abbreviated as AU, au, a.u., or ua) is a unit of length equal to \(149,597,870,700 metres\) (\(92,955,807.273 mi\)) or approximately the mean Earth Sun distance."
"http://qudt.org/vocab/unit/B","Bel","http://qudt.org/vocab/dimensionvector/A0E0L0I0M0H0T0D1",NA,NA,"A logarithmic unit of sound pressure equal to 10 decibels (dB),  It is defined as: \(1 B = (1/2) \log_{10}(Np)\)"
"http://qudt.org/vocab/unit/BAN","Ban","http://qudt.org/vocab/dimensionvector/A0E0L0I0M0H0T0D1",2.30258509,NA,"A ban is a logarithmic unit which measures information or entropy, based on base 10 logarithms and powers of 10, rather than the powers of 2 and base 2 logarithms which define the bit. One ban is approximately \(3.32 (log_2 10) bits\)."
"http://qudt.org/vocab/unit/BAR","Bar","http://qudt.org/vocab/dimensionvector/A0E0L-1I0M1H0T-2D0",1e+05,NA,"The bar is a non-SI unit of pressure, defined by the IUPAC as exactly equal to \(100,000\,Pa\). It is about equal to the atmospheric pressure on Earth at sea level, and since 1982 the IUPAC has recommended that the standard for atmospheric pressure should be harmonized to \(100,000\,Pa = 1 \,bar \approx 750.0616827\, Torr\). Units derived from the bar are the megabar (symbol: Mbar), kilobar (symbol: kbar), decibar (symbol: dbar), centibar (symbol: cbar), and millibar (symbol: mbar or mb). They are not SI or cgs units, but they are accepted for use with the SI."
"http://qudt.org/vocab/unit/BAR-L-PER-SEC","Bar Liter Per Second","http://qudt.org/vocab/dimensionvector/A0E0L2I0M1H0T-3D0",100,NA,NA
"http://qudt.org/vocab/unit/BAR-M3-PER-SEC","Bar Cubic Meter Per Second","http://qudt.org/vocab/dimensionvector/A0E0L2I0M1H0T-3D0",100,NA,NA
"http://qudt.org/vocab/unit/BAR-PER-BAR","Bar Per Bar","http://qudt.org/vocab/dimensionvector/A0E0L0I0M0H0T0D1",1,NA,NA
"http://qudt.org/vocab/unit/BAR-PER-K","Bar Per Kelvin","http://qudt.org/vocab/dimensionvector/A0E0L-1I0M1H-1T-2D0",1e+05,NA,NA
"http://qudt.org/vocab/unit/BARAD","Barad","http://qudt.org/vocab/dimensionvector/A0E0L-1I0M1H0T-2D0",0.1,NA,"A barad is a dyne per square centimetre (\(dyn \cdot cm^{-2}\)), and is equal to \(0.1 Pa \) (\(1 \, micro \, bar\), \(0.000014504 \, p.s.i.\)). Note that this is precisely the microbar, the confusable bar being related in size to the normal atmospheric pressure, at \(100\,dyn \cdot cm^{-2}\). Accordingly barad was not abbreviated, so occurs prefixed as in \(cbarad = centibarad\). Despite being the coherent unit for pressure in c.g.s., barad was probably much less common than the non-coherent bar. Barad is sometimes called \(barye\), a name also used for \(bar\)."
"http://qudt.org/vocab/unit/BARN","Barn","http://qudt.org/vocab/dimensionvector/A0E0L2I0M0H0T0D0",0,NA,"A barn (symbol b) is a unit of area. Originally used in nuclear physics for expressing the cross sectional area of nuclei and nuclear reactions, today it is used in all fields of high energy physics to express the cross sections of any scattering process, and is best understood as a measure of the probability of interaction between small particles. A barn is defined as \(10^{-28} m^2 (100 fm^2)\) and is approximately the cross sectional area of a uranium nucleus. The barn is also the unit of area used in nuclear quadrupole resonance and nuclear magnetic resonance to quantify the interaction of a nucleus with an electric field gradient. While the barn is not an SI unit, it is accepted for use with the SI due to its continued use in particle physics."
"http://qudt.org/vocab/unit/BARYE","Barye","http://qudt.org/vocab/dimensionvector/A0E0L-1I0M1H0T-2D0",0.1,"<p>The barye, or sometimes barad, barrie, bary, baryd, baryed, or barie, is the centimetre-gram-second (CGS) unit of pressure. It is equal to 1 dyne per square centimetre.</p>",NA
"http://qudt.org/vocab/unit/BBL","Barrel","http://qudt.org/vocab/dimensionvector/A0E0L3I0M0H0T0D0",NA,"A barrel is one of several units of volume, with dry barrels, fluid barrels (UK beer barrel, U.S. beer barrel), oil barrel, etc. The volume of some barrel units is double others, with various volumes in the range of about 100-200 litres (22-44 imp gal; 26-53 US gal).",NA
"http://qudt.org/vocab/unit/BBL_UK_PET","Barrel (UK Petroleum)","http://qudt.org/vocab/dimensionvector/A0E0L3I0M0H0T0D0",0.1591132,NA,NA
"http://qudt.org/vocab/unit/BBL_UK_PET-PER-DAY","Barrel (UK Petroleum) Per Day","http://qudt.org/vocab/dimensionvector/A0E0L3I0M0H0T-1D0",1.841587e-06,NA,NA
"http://qudt.org/vocab/unit/BBL_UK_PET-PER-HR","Barrel (UK Petroleum) Per Hour","http://qudt.org/vocab/dimensionvector/A0E0L3I0M0H0T-1D0",4.41981e-05,NA,NA
"http://qudt.org/vocab/unit/BBL_UK_PET-PER-MIN","Barrel (UK Petroleum) Per Minute","http://qudt.org/vocab/dimensionvector/A0E0L3I0M0H0T-1D0",0.002651886,NA,NA
"http://qudt.org/vocab/unit/BBL_UK_PET-PER-SEC","Barrel (UK Petroleum) Per Second","http://qudt.org/vocab/dimensionvector/A0E0L3I0M0H0T-1D0",0.1591132,NA,NA
"http://qudt.org/vocab/unit/BBL_US","Barrel (US)","http://qudt.org/vocab/dimensionvector/A0E0L3I0M0H0T0D0",0.1589873,NA,NA
"http://qudt.org/vocab/unit/BBL_US-PER-DAY","Barrel (US) Per Day","http://qudt.org/vocab/dimensionvector/A0E0L3I0M0H0T-1D0",1.84e-06,NA,NA
"http://qudt.org/vocab/unit/BBL_US-PER-MIN","Barrel (US) Per Minute","http://qudt.org/vocab/dimensionvector/A0E0L3I0M0H0T-1D0",0.0026498,NA,NA
"http://qudt.org/vocab/unit/BBL_US_DRY","Dry Barrel (US)","http://qudt.org/vocab/dimensionvector/A0E0L3I0M0H0T0D0",0.1156281989625,NA,NA
"http://qudt.org/vocab/unit/BBL_US_PET-PER-HR","Barrel (US Petroleum) Per Hour","http://qudt.org/vocab/dimensionvector/A0E0L3I0M0H0T-1D0",4.4163e-05,NA,NA
"http://qudt.org/vocab/unit/BBL_US_PET-PER-SEC","Barrel (US Petroleum) Per Second","http://qudt.org/vocab/dimensionvector/A0E0L3I0M0H0T-1D0",0.1589873,NA,NA
"http://qudt.org/vocab/unit/BEAT-PER-MIN","Heart Beats per Minute","http://qudt.org/vocab/dimensionvector/A0E0L0I0M0H0T-1D0",NA,NA,"""Heart Beat per Minute"" is a unit for  'Heart Rate' expressed as \(BPM\)."
"http://qudt.org/vocab/unit/BFT","Beaufort","http://qudt.org/vocab/dimensionvector/A0E0L1I0M0H0T-1D0",0,NA,NA
"http://qudt.org/vocab/unit/BIOT","Biot","http://qudt.org/vocab/dimensionvector/A0E1L0I0M0H0T0D0",10,"""Biot"" is another name for the abampere (aA), which is the basic electromagnetic unit of electric current in the emu-cgs (centimeter-gram-second) system of units. It is called after a French physicist, astronomer, and mathematician Jean-Baptiste Biot. One abampere is equal to ten amperes in the SI system of units. One abampere is the current, which produces a force of 2 dyne/cm between two infinitively long parallel wires that are 1 cm apart.",NA
"http://qudt.org/vocab/unit/BIT","Bit","http://qudt.org/vocab/dimensionvector/A0E0L0I0M0H0T0D1",0.693147180559945,"In information theory, a bit is the amount of information that, on average, can be stored in a discrete bit. It is thus the amount of information carried by a choice between two equally likely outcomes. One bit corresponds to about 0.693 nats (ln(2)), or 0.301 hartleys (log10(2)).",NA
"http://qudt.org/vocab/unit/BIT-PER-SEC","Bit per Second","http://qudt.org/vocab/dimensionvector/A0E0L0I0M0H0T-1D0",0.693147180559945,"A bit per second (B/s) is a unit of data transfer rate equal to 1 bits per second.",NA
"http://qudt.org/vocab/unit/BQ","Becquerel","http://qudt.org/vocab/dimensionvector/A0E0L0I0M0H0T-1D0",1,"The SI derived unit of activity, usually meaning radioactivity. ""Radioactivity"" is caused when atoms disintegrate, ejecting energetic particles. One becquerel is the radiation caused by one disintegration per second; this is equivalent to about 27.0270 picocuries (pCi). The unit is named for a French physicist, Antoine-Henri Becquerel (1852-1908), the discoverer of radioactivity. Note: both the becquerel and the hertz are basically defined as one event per second, yet they measure different things. The hertz is used to measure the rates of events that happen periodically in a fixed and definite cycle. The becquerel is used to measure the rates of events that happen sporadically and unpredictably, not in a definite cycle.",NA
"http://qudt.org/vocab/unit/BQ-PER-KiloGM","Becquerel per Kilogram","http://qudt.org/vocab/dimensionvector/A0E0L0I0M-1H0T-1D0",1,NA,"The only unit in the category of Specific radioactivity. It is also known as becquerels per kilogram, becquerel/kilogram. This unit is commonly used in the SI unit system. Becquerel Per Kilogram (Bq/kg) has a dimension of \(M{-1}T{-1}\) where \(M\) is mass, and \(T\) is time. It essentially the same as the corresponding standard SI unit \(/kg/s\)."
"http://qudt.org/vocab/unit/BQ-PER-L","Becquerels per litre","http://qudt.org/vocab/dimensionvector/A0E0L-3I0M0H0T-1D0",1000,NA,NA
"http://qudt.org/vocab/unit/BQ-PER-M2","Becquerel per Square Meter","http://qudt.org/vocab/dimensionvector/A0E0L-2I0M0H0T-1D0",1,NA,NA
"http://qudt.org/vocab/unit/BQ-PER-M3","Becquerel per Cubic Meter","http://qudt.org/vocab/dimensionvector/A0E0L-3I0M0H0T-1D0",1,NA,"Becquerel Per Cubic Meter (\(Bq/m3\)) is a unit in the category of Radioactivity concentration. It is also known as becquerels per cubic meter, becquerel per cubic metre, becquerels per cubic metre, becquerel/cubic inch. This unit is commonly used in the SI unit system. Becquerel Per Cubic Meter (Bq/m3) has a dimension of \(L{-3}T{-1}\) where \(L\) is length, and \(T\) is time. It essentially the same as the corresponding standard SI unit \(/s\cdot m{3}\)."
"http://qudt.org/vocab/unit/BQ-SEC-PER-M3","Becquerels second per cubic metre","http://qudt.org/vocab/dimensionvector/A0E0L-3I0M0H0T0D0",1,NA,NA
"http://qudt.org/vocab/unit/BREATH-PER-MIN","Breath per Minute","http://qudt.org/vocab/dimensionvector/A0E0L0I0M0H0T-1D0",NA,"A unit of respiratory rate.",NA
"http://qudt.org/vocab/unit/BTU_IT","British Thermal Unit (International Definition)","http://qudt.org/vocab/dimensionvector/A0E0L2I0M1H0T-2D0",1055.05585262,NA,"\(\textit{British Thermal Unit}\) (BTU or Btu) is a traditional unit of energy equal to about \(1.0550558526 \textit{ kilojoule}\). It is approximately the amount of energy needed to heat 1 pound (0.454 kg) of water from \(39 \,^{\circ}{\rm F}\)  to \(40 \,^{\circ}{\rm F}\) . The unit is most often used in the power, steam generation, heating and air conditioning industries. In scientific contexts the BTU has largely been replaced by the SI unit of energy, the \(joule\), though it may be used as a measure of agricultural energy production (BTU/kg). It is still used unofficially in metric English-speaking countries (such as Canada), and remains the standard unit of classification for air conditioning units manufactured and sold in many non-English-speaking metric countries."
"http://qudt.org/vocab/unit/BTU_IT-FT","BTU Foot","http://qudt.org/vocab/dimensionvector/A0E0L3I0M1H0T-2D0",321.581024,NA,"\({\bf BTU_{IT} \, Foot}\) is an Imperial unit for \(\textit{Thermal Energy Length}\) expressed as \(Btu-ft\)."
"http://qudt.org/vocab/unit/BTU_IT-FT-PER-FT2-HR-DEG_F","BTU (IT) Foot per Square Foot Hour Degree Fahrenheit","http://qudt.org/vocab/dimensionvector/A0E0L1I0M1H-1T-3D0",1.730734666,NA,"\(BTU_{IT}\), Foot per Square Foot Hour Degree Fahrenheit</em> is an Imperial unit for 'Thermal Conductivity' expressed as \(Btu_{it} \cdot ft/(hr \cdot ft^2  \cdot degF)\)."
"http://qudt.org/vocab/unit/BTU_IT-IN","BTU Inch","http://qudt.org/vocab/dimensionvector/A0E0L3I0M1H0T-2D0",26.7984187,NA,"\({\bf BTU \, Inch}\) is an Imperial unit for 'Thermal Energy Length' expressed as \(Btu-in\)."
