"qudtUri","qudtLabel","qudtDimensionVector","qudtConversionMultiplier","nonLatexDescription","latexDescription"
"http://qudt.org/vocab/unit/M2-PER-MOL","Square Meter per Mole","http://qudt.org/vocab/dimensionvector/A-1E0L2I0M0H0T0D0",1,"Square Meter Per Mole (m2/mol) is a unit in the category of Specific Area. It is also known as square meters per mole, square metre per per, square metres per per, square meter/per, square metre/per. This unit is commonly used in the SI unit system. Square Meter Per Mole (m2/mol) has a dimension of M-1L2 where M is mass, and L is length. This unit is the standard SI unit in this category.",NA
"http://qudt.org/vocab/unit/M2-PER-N","Square Meter Per Newton","http://qudt.org/vocab/dimensionvector/A0E0L1I0M-1H0T2D0",1,NA,NA
"http://qudt.org/vocab/unit/M2-PER-SEC","Square Meter per Second","http://qudt.org/vocab/dimensionvector/A0E0L2I0M0H0T-1D0",1,NA,"\(Square Metres per second is the SI derived unit of angular momentum, defined by distance or displacement in metres multiplied by distance again in metres and divided by time in seconds. The unit is written in symbols as m2/s or m2u00b7s-1 or m2s-1. It may be better understood when phrased as ""metres per second times metres"", i.e. the momentum of an object with respect to a position.\)"
"http://qudt.org/vocab/unit/M2-PER-SEC2","Square metres per square second","http://qudt.org/vocab/dimensionvector/A0E0L2I0M0H0T-2D0",1,NA,NA
"http://qudt.org/vocab/unit/M2-PER-SR","Square Meter per Steradian","http://qudt.org/vocab/dimensionvector/A0E0L2I0M0H0T0D0",1,NA,NA
"http://qudt.org/vocab/unit/M2-PER-SR-J","Square Meter per Steradian Joule","http://qudt.org/vocab/dimensionvector/A0E0L0I0M-1H0T2D0",1,NA,NA
"http://qudt.org/vocab/unit/M2-PER-V-SEC","Square Meter per Volt Second","http://qudt.org/vocab/dimensionvector/A0E1L0I0M-1H0T4D0",1,NA,NA
"http://qudt.org/vocab/unit/M2-SEC-PER-RAD","Square metre seconds per radian","http://qudt.org/vocab/dimensionvector/A0E0L2I0M0H0T1D0",1,NA,NA
"http://qudt.org/vocab/unit/M2-SR","Square Meter Steradian","http://qudt.org/vocab/dimensionvector/A0E0L2I0M0H0T0D0",1,NA,"""Square Meter Steradian"" is a unit for  'Area Angle' expressed as \(m^{2}-sr\)."
"http://qudt.org/vocab/unit/M3","Cubic Meter","http://qudt.org/vocab/dimensionvector/A0E0L3I0M0H0T0D0",1,"The SI unit of volume, equal to 1.0e6 cm3, 1000 liters, 35.3147 ft3, or 1.30795 yd3. A cubic meter holds about 264.17 U.S. liquid gallons or 219.99 British Imperial gallons.",NA
"http://qudt.org/vocab/unit/M3-PER-C","Cubic Meter per Coulomb","http://qudt.org/vocab/dimensionvector/A0E-1L3I0M0H0T-1D0",1,NA,NA
"http://qudt.org/vocab/unit/M3-PER-DAY","Cubic Meter Per Day","http://qudt.org/vocab/dimensionvector/A0E0L3I0M0H0T-1D0",1.157407e-05,NA,NA
"http://qudt.org/vocab/unit/M3-PER-HA","Cubic Meter per Hectare","http://qudt.org/vocab/dimensionvector/A0E0L1I0M0H0T0D0",1e-04,NA,NA
"http://qudt.org/vocab/unit/M3-PER-HR","Cubic Meter per Hour","http://qudt.org/vocab/dimensionvector/A0E0L3I0M0H0T-1D0",0.00027777777777777,"Cubic Meter Per Hour (m3/h) is a unit in the category of Volume flow rate. It is also known as cubic meters per hour, cubic metre per hour, cubic metres per hour, cubic meter/hour, cubic metre/hour, cubic meter/hr, cubic metre/hr, flowrate. Cubic Meter Per Hour (m3/h) has a dimension of L3T-1 where L is length, and T is time. It can be converted to the corresponding standard SI unit m3/s by multiplying its value by a factor of 0.00027777777.",NA
"http://qudt.org/vocab/unit/M3-PER-K","Cubic Meter per Kelvin","http://qudt.org/vocab/dimensionvector/A0E0L3I0M0H-1T0D0",1,NA,NA
"http://qudt.org/vocab/unit/M3-PER-KiloGM","Cubic Meter per Kilogram","http://qudt.org/vocab/dimensionvector/A0E0L3I0M-1H0T0D0",1,"Cubic Meter Per Kilogram (m3/kg) is a unit in the category of Specific volume. It is also known as cubic meters per kilogram, cubic metre per kilogram, cubic metres per kilogram, cubic meter/kilogram, cubic metre/kilogram. This unit is commonly used in the SI unit system. Cubic Meter Per Kilogram (m3/kg) has a dimension of M-1L3 where M is mass, and L is length. This unit is the standard SI unit in this category.",NA
"http://qudt.org/vocab/unit/M3-PER-KiloGM-SEC2","Cubic Meter per Kilogram Square Second","http://qudt.org/vocab/dimensionvector/A0E0L3I0M-1H0T-2D0",1,NA,NA
"http://qudt.org/vocab/unit/M3-PER-M2","Cubic Meter Per Square Meter","http://qudt.org/vocab/dimensionvector/A0E0L1I0M0H0T0D0",1,NA,NA
"http://qudt.org/vocab/unit/M3-PER-M3","Cubic Meter Per Cubic Meter","http://qudt.org/vocab/dimensionvector/A0E0L0I0M0H0T0D1",1,NA,NA
"http://qudt.org/vocab/unit/M3-PER-MIN","Cubic Meter Per Minute","http://qudt.org/vocab/dimensionvector/A0E0L3I0M0H0T-1D0",0.01666667,NA,NA
"http://qudt.org/vocab/unit/M3-PER-MOL","Cubic Meter per Mole","http://qudt.org/vocab/dimensionvector/A-1E0L3I0M0H0T0D0",1,NA,"<p>The molar volume, symbol \(Vm\), is the volume occupied by one mole of a substance (chemical element or chemical compound) at a given temperature and pressure. It is equal to the molar mass (M) divided by the mass density. It has the SI unit cubic metres per mole \(m3/mol\), although it is more practical to use the units cubic decimetres per mole \(dm3/mol\) for gases and cubic centimetres per mole \(cm3/mol\) for liquids and solids</p>."
"http://qudt.org/vocab/unit/M3-PER-MOL-SEC","Cubic Centimeter per Mole Second","http://qudt.org/vocab/dimensionvector/A-1E0L3I0M0H0T-1D0",1,NA,"A unit that is the SI base unit metre with the exponent 3 divided by the SI base unit mol multiplied by the SI base unit second."
"http://qudt.org/vocab/unit/M3-PER-SEC","Cubic Meter per Second","http://qudt.org/vocab/dimensionvector/A0E0L3I0M0H0T-1D0",1,NA,"A cubic metre per second (\(m^{3}s^{-1}, m^{3}/s\)), cumecs or cubic meter per second in American English) is a derived SI unit of flow rate equal to that of a stere or cube with sides of one metre ( u0303 39.37 in) in length exchanged or moving each second. It is popularly used for water flow, especially in rivers and streams, and fractions for HVAC values measuring air flow."
"http://qudt.org/vocab/unit/M3-PER-SEC2","Cubic Meter per Square Second","http://qudt.org/vocab/dimensionvector/A0E0L3I0M0H0T-2D0",1,NA,"\(\textit{Cubic Meter per Square Second}\) is a C.G.S System unit for  \(\textit{Standard Gravitational Parameter}\) expressed as \(m^3/s^2\)"
"http://qudt.org/vocab/unit/M4","Quartic Meter","http://qudt.org/vocab/dimensionvector/A0E0L4I0M0H0T0D0",1,"A unit associated with area moments of inertia.",NA
"http://qudt.org/vocab/unit/M4-PER-SEC","Metres to the power four per second","http://qudt.org/vocab/dimensionvector/A0E0L4I0M0H0T-1D0",1,NA,NA
"http://qudt.org/vocab/unit/M5","Quintic Meter","http://qudt.org/vocab/dimensionvector/A0E0L5I0M0H0T0D0",1,NA,NA
"http://qudt.org/vocab/unit/M6","Sextic Meter","http://qudt.org/vocab/dimensionvector/A0E0L6I0M0H0T0D0",1,NA,NA
"http://qudt.org/vocab/unit/MACH","Mach","http://qudt.org/vocab/dimensionvector/A0E0L0I0M0H0T0D1",NA,NA,"""Mach"" is a unit for  'Dimensionless Ratio' expressed as \(mach\)."
"http://qudt.org/vocab/unit/MDOLLAR-PER-FLIGHT","Million US Dollars per Flight","http://qudt.org/vocab/dimensionvector/A0E0L0I0M0H0T0D1",NA,NA,NA
"http://qudt.org/vocab/unit/MebiBYTE","Mebibyte","http://qudt.org/vocab/dimensionvector/A0E0L0I0M0H0T0D1",5814539.9840226,NA,"The mebibyte is a multiple of the unit byte for digital information equivalent to \(1024^{2} bytes\) or \(2^{20} bytes\)."
"http://qudt.org/vocab/unit/MegaA","Megaampere","http://qudt.org/vocab/dimensionvector/A0E1L0I0M0H0T0D0",1e+06,NA,NA
"http://qudt.org/vocab/unit/MegaA-PER-M2","Megaampere Per Square Meter","http://qudt.org/vocab/dimensionvector/A0E1L-2I0M0H0T0D0",1e+06,NA,NA
"http://qudt.org/vocab/unit/MegaBAR","Megabar","http://qudt.org/vocab/dimensionvector/A0E0L-1I0M1H0T-2D0",1e+11,NA,"The bar is a non-SI unit of pressure, defined by the IUPAC as exactly equal to 100,000 Pa. It is about equal to the atmospheric pressure on Earth at sea level, and since 1982 the IUPAC has recommended that the standard for atmospheric pressure should be harmonized to \(100,000 Pa = 1 bar \approx 750.0616827 Torr\). Units derived from the bar are the megabar (symbol: Mbar), kilobar (symbol: kbar), decibar (symbol: dbar), centibar (symbol: cbar), and millibar (symbol: mbar or mb). They are not SI or cgs units, but they are accepted for use with the SI."
"http://qudt.org/vocab/unit/MegaBIT-PER-SEC","Megabit per Second","http://qudt.org/vocab/dimensionvector/A0E0L0I0M0H0T-1D0",693147.180559945,"A megabit per second (Mbit/s or Mb/s; not to be confused with mbit/s which means millibit per second, or with Mbitps which means megabit picosecond) is a unit of data transfer rate equal to 1,000,000 bits per second or 1,000 kilobits per second or 125,000 bytes per second or 125 kilobytes per second.",NA
"http://qudt.org/vocab/unit/MegaBQ","Megabecquerel","http://qudt.org/vocab/dimensionvector/A0E0L0I0M0H0T-1D0",1e+06,NA,NA
"http://qudt.org/vocab/unit/MegaBTU_IT-PER-HR","Mega British Thermal Unit (International Definition) per Hour","http://qudt.org/vocab/dimensionvector/A0E0L2I0M1H0T-3D0",293071.07,NA,NA
"http://qudt.org/vocab/unit/MegaBYTE","Mega byte","http://qudt.org/vocab/dimensionvector/A0E0L0I0M0H0T0D1",5545177.44447956,NA,"The megabyte is defined here as one million Bytes. Also, see unit:MebiBYTE."
"http://qudt.org/vocab/unit/MegaC","MegaCoulomb","http://qudt.org/vocab/dimensionvector/A0E1L0I0M0H0T1D0",1e+06,NA,"A MegaCoulomb is \(10^{6} C\)."
"http://qudt.org/vocab/unit/MegaC-PER-M2","Megacoulomb Per Square Meter","http://qudt.org/vocab/dimensionvector/A0E1L-2I0M0H0T1D0",1e+06,NA,NA
"http://qudt.org/vocab/unit/MegaC-PER-M3","Megacoulomb Per Cubic Meter","http://qudt.org/vocab/dimensionvector/A0E1L-3I0M0H0T1D0",1e+06,NA,NA
"http://qudt.org/vocab/unit/MegaDOLLAR_US-PER-FLIGHT","Million US Dollars per Flight","http://qudt.org/vocab/dimensionvector/A0E0L0I0M0H0T0D1",NA,NA,NA
"http://qudt.org/vocab/unit/MegaEV","Mega Electron Volt","http://qudt.org/vocab/dimensionvector/A0E0L2I0M1H0T-2D0",1.6021e-13,NA,"\(\textbf{Mega Electron Volt} is a unit for  'Energy And Work' expressed as \(MeV\)."
"http://qudt.org/vocab/unit/MegaEV-FemtoM","Mega Electron Volt Femtometer","http://qudt.org/vocab/dimensionvector/A0E0L3I0M1H0T-2D0",0,NA,"\(\textbf{Mega Electron Volt Femtometer} is a unit for  'Length Energy' expressed as \(MeV fm\)."
"http://qudt.org/vocab/unit/MegaEV-PER-CentiM","Mega Electron Volt per Centimeter","http://qudt.org/vocab/dimensionvector/A0E0L1I0M1H0T-2D0",1.602176e-11,NA,"""Mega Electron Volt per Centimeter"" is a unit for  'Linear Energy Transfer' expressed as \(MeV/cm\)."
"http://qudt.org/vocab/unit/MegaEV-PER-SpeedOfLight","Mega Electron Volt per Speed of Light","http://qudt.org/vocab/dimensionvector/A0E0L1I0M1H0T-1D0",NA,NA,"""Mega Electron Volt per Speed of Light"" is a unit for  'Linear Momentum' expressed as \(MeV/c\)."
"http://qudt.org/vocab/unit/MegaGM","Megagram","http://qudt.org/vocab/dimensionvector/A0E0L0I0M1H0T0D0",1000,NA,NA
"http://qudt.org/vocab/unit/MegaGM-PER-HA","Megagram Per Hectare","http://qudt.org/vocab/dimensionvector/A0E0L-2I0M1H0T0D0",0.1,NA,NA
"http://qudt.org/vocab/unit/MegaGM-PER-M3","Megagram Per Cubic Meter","http://qudt.org/vocab/dimensionvector/A0E0L-3I0M1H0T0D0",1000,NA,NA
"http://qudt.org/vocab/unit/MegaHZ","Megahertz","http://qudt.org/vocab/dimensionvector/A0E0L0I0M0H0T-1D0",1e+06,NA,"""Megahertz"" is a C.G.S System unit for  'Frequency' expressed as \(MHz\)."
"http://qudt.org/vocab/unit/MegaHZ-M","Megahertz Meter","http://qudt.org/vocab/dimensionvector/A0E0L1I0M0H0T-1D0",1e+06,NA,NA
"http://qudt.org/vocab/unit/MegaHZ-PER-K","Mega Hertz per Kelvin","http://qudt.org/vocab/dimensionvector/A0E0L0I0M0H-1T-1D0",1e+06,NA,"\(\textbf{Mega Hertz per Kelvin} is a unit for 'Inverse Time Temperature' expressed as \(MHz K^{-1}\)."
"http://qudt.org/vocab/unit/MegaHZ-PER-T","Mega Hertz per Tesla","http://qudt.org/vocab/dimensionvector/A0E1L0I0M-1H0T1D0",1e+06,NA,"""Mega Hertz per Tesla"" is a unit for  'Electric Charge Per Mass' expressed as \(MHz T^{-1}\)."
"http://qudt.org/vocab/unit/MegaJ","Megajoule","http://qudt.org/vocab/dimensionvector/A0E0L2I0M1H0T-2D0",1e+06,NA,NA
"http://qudt.org/vocab/unit/MegaJ-PER-K","MegaJoule per Kelvin","http://qudt.org/vocab/dimensionvector/A0E0L2I0M1H-1T-2D0",1e+06,NA,"MegaJoule Per Kelvin (MegaJ/K) is a unit in the category of Entropy."
"http://qudt.org/vocab/unit/MegaJ-PER-KiloGM","Megajoule Per Kilogram","http://qudt.org/vocab/dimensionvector/A0E0L2I0M0H0T-2D0",1e+06,NA,NA
"http://qudt.org/vocab/unit/MegaJ-PER-M2","Megajoule Per Square Meter","http://qudt.org/vocab/dimensionvector/A0E0L0I0M1H0T-2D0",1e+06,NA,"MegaJoule Per Square Meter (\(MegaJ/m^2\)) is a unit in the category of Energy density."
"http://qudt.org/vocab/unit/MegaJ-PER-M3","Megajoule Per Cubic Meter","http://qudt.org/vocab/dimensionvector/A0E0L-1I0M1H0T-2D0",1e+06,NA,NA
"http://qudt.org/vocab/unit/MegaJ-PER-SEC","Megajoule Per Second","http://qudt.org/vocab/dimensionvector/A0E0L2I0M1H0T-3D0",1e+06,NA,NA
"http://qudt.org/vocab/unit/MegaL","Megalitre","http://qudt.org/vocab/dimensionvector/A0E0L3I0M0H0T0D0",1000,NA,NA
"http://qudt.org/vocab/unit/MegaLB_F","Mega Pound Force","http://qudt.org/vocab/dimensionvector/A0E0L1I0M1H0T-2D0",4448.222,NA,NA
"http://qudt.org/vocab/unit/MegaN","Meganewton","http://qudt.org/vocab/dimensionvector/A0E0L1I0M1H0T-2D0",1e+06,NA,NA
"http://qudt.org/vocab/unit/MegaN-M","Meganewton Meter","http://qudt.org/vocab/dimensionvector/A0E0L2I0M1H0T-2D0",1e+06,NA,NA
"http://qudt.org/vocab/unit/MegaOHM","Megaohm","http://qudt.org/vocab/dimensionvector/A0E-2L2I0M1H0T-3D0",1e+06,NA,NA
"http://qudt.org/vocab/unit/MegaPA","Megapascal","http://qudt.org/vocab/dimensionvector/A0E0L-1I0M1H0T-2D0",1e+06,NA,NA
"http://qudt.org/vocab/unit/MegaPA-L-PER-SEC","Megapascal Liter Per Second","http://qudt.org/vocab/dimensionvector/A0E0L2I0M1H0T-3D0",1000,NA,NA
"http://qudt.org/vocab/unit/MegaPA-M0pt5","Megapascal Square Root Meter","http://qudt.org/vocab/dimensionvector/A0E0L-0pt5I0M1H0T-2D0",1e+06,NA,NA
"http://qudt.org/vocab/unit/MegaPA-M3-PER-SEC","Megapascal Cubic Meter Per Second","http://qudt.org/vocab/dimensionvector/A0E0L2I0M1H0T-3D0",1e+06,NA,NA
"http://qudt.org/vocab/unit/MegaPA-PER-BAR","Megapascal Per Bar","http://qudt.org/vocab/dimensionvector/A0E0L0I0M0H0T0D1",10,NA,NA
"http://qudt.org/vocab/unit/MegaPA-PER-K","Megapascal Per Kelvin","http://qudt.org/vocab/dimensionvector/A0E0L-1I0M1H-1T-2D0",1e+06,NA,NA
"http://qudt.org/vocab/unit/MegaS","MegaSiemens","http://qudt.org/vocab/dimensionvector/A0E2L-2I0M-1H0T3D0",1e+06,NA,NA
"http://qudt.org/vocab/unit/MegaS-PER-M","Megasiemens Per Meter","http://qudt.org/vocab/dimensionvector/A0E2L-3I0M-1H0T3D0",1e+06,NA,NA
"http://qudt.org/vocab/unit/MegaTOE","Megaton of Oil Equivalent","http://qudt.org/vocab/dimensionvector/A0E0L2I0M1H0T-2D0",4.1868e+16,"The tonne of oil equivalent (toe) is a unit of energy: the amount of energy released by burning one tonne of crude oil, approximately 42 GJ (as different crude oils have different calorific values, the exact value of the toe is defined by convention; unfortunately there are several slightly different definitions as discussed below). The toe is sometimes used for large amounts of energy, as it can be more intuitive to visualise, say, the energy released by burning 1000 tonnes of oil than 42,000 billion joules (the SI unit of energy).</p>
<p>Multiples of the toe are used, in particular the megatoe (Mtoe, one million toe) and the gigatoe (Gtoe, one billion toe).</p>",NA
"http://qudt.org/vocab/unit/MegaV","Megavolt","http://qudt.org/vocab/dimensionvector/A0E-1L2I0M1H0T-3D0",1e+06,NA,NA
"http://qudt.org/vocab/unit/MegaV-A","Megavolt Ampere","http://qudt.org/vocab/dimensionvector/A0E0L2I0M1H0T-3D0",1e+06,NA,NA
"http://qudt.org/vocab/unit/MegaV-A-HR","Megavolt Ampere Hour","http://qudt.org/vocab/dimensionvector/A0E0L2I0M1H0T-2D0",3.6e+09,NA,NA
"http://qudt.org/vocab/unit/MegaV-A_Reactive","Megavolt Ampere Reactive","http://qudt.org/vocab/dimensionvector/A0E0L2I0M1H0T-3D0",1e+06,NA,NA
"http://qudt.org/vocab/unit/MegaV-A_Reactive-HR","Megavolt Ampere Reactive Hour","http://qudt.org/vocab/dimensionvector/A0E0L2I0M1H0T-2D0",3.6e+09,NA,NA
"http://qudt.org/vocab/unit/MegaV-PER-M","Megavolt Per Meter","http://qudt.org/vocab/dimensionvector/A0E-1L1I0M1H0T-3D0",1e+06,NA,NA
"http://qudt.org/vocab/unit/MegaW","MegaW","http://qudt.org/vocab/dimensionvector/A0E0L2I0M1H0T-3D0",1e+06,NA,NA
"http://qudt.org/vocab/unit/MegaW-HR","Megawatt Hour","http://qudt.org/vocab/dimensionvector/A0E0L2I0M1H0T-2D0",3.6e+09,NA,NA
"http://qudt.org/vocab/unit/MegaYR","Million Years","http://qudt.org/vocab/dimensionvector/A0E0L0I0M0H0T1D0",3.15576e+13,NA,NA
"http://qudt.org/vocab/unit/MESH","Mesh","http://qudt.org/vocab/dimensionvector/A0E0L-1I0M0H0T0D0",0,NA,NA
"http://qudt.org/vocab/unit/MHO","Mho","http://qudt.org/vocab/dimensionvector/A0E2L-3I0M-1H0T3D0",1,NA,"""Mho"" is a C.G.S System unit for  'Electric Conductivity' expressed as \(mho\)."
"http://qudt.org/vocab/unit/MHO_Stat","Statmho","http://qudt.org/vocab/dimensionvector/A0E2L-3I0M-1H0T3D0",1.1126e-12,NA,"""StatMHO"" is the unit of conductance, admittance, and susceptance in the C.G.S e.s.u system of units. One \(statmho\) is the conductance between two points in a conductor when a constant potential difference of \(1 \; statvolt\) applied between the points produces in the conductor a current of \(1 \; statampere\), the conductor not being the source of any electromotive force, approximately \(1.1126 \times 10^{-12} mho\)."
"http://qudt.org/vocab/unit/MI","International Mile","http://qudt.org/vocab/dimensionvector/A0E0L1I0M0H0T0D0",1609.344,"The exact length of the land mile varied slightly among English-speaking countries until the international yard and pound agreement in 1959 established the yard as exactly 0.9144 metres, giving a mile of exactly 1,609.344 metres. The United States adopted this international mile for most purposes, but retained the pre-1959 mile for some land-survey data, terming it the US survey mile. In the US, statute mile formally refers to the survey mile, about 3.219 mm (1/8 inch) longer than the international mile (the international mile is exactly 0.0002% less than the US survey mile).",NA
"http://qudt.org/vocab/unit/MI-PER-HR","Mile per Hour","http://qudt.org/vocab/dimensionvector/A0E0L1I0M0H0T-1D0",0.44704,"Miles per hour is an imperial unit of speed expressing the number of statute miles covered in one hour. It is currently the standard unit used for speed limits, and to express speeds generally, on roads in the United Kingdom and the United States. A common abbreviation is mph or MPH.",NA
"http://qudt.org/vocab/unit/MI-PER-MIN","Mile per Minute","http://qudt.org/vocab/dimensionvector/A0E0L1I0M0H0T-1D0",26.8224,"Miles per minute is an imperial unit of speed expressing the number of statute miles covered in one minute.",NA
"http://qudt.org/vocab/unit/MI-PER-SEC","Mile per Second","http://qudt.org/vocab/dimensionvector/A0E0L1I0M0H0T-1D0",1609.344,"Miles per second is an imperial unit of speed expressing the number of statute miles covered in one second.",NA
"http://qudt.org/vocab/unit/MI_N","Nautical Mile","http://qudt.org/vocab/dimensionvector/A0E0L1I0M0H0T0D0",1852,"A unit of distance used primarily at sea and in aviation. The nautical mile is defined to be the average distance on the Earth's surface represented by one minute of latitude.  In 1929 an international conference in Monaco redefined the nautical mile to be exactly 1852 meters or 6076.115 49 feet, a distance known as the international nautical mile. The international nautical mile equals about 1.1508 statute miles. There are usually 3 nautical miles in a league. The unit is designed to equal 1/60 degree, although actual degrees of latitude vary from about 59.7 to 60.3 nautical miles. (Note: using data from the Geodetic Reference System 1980, the ""true"" length of a nautical mile would be 1852.216 meters.)",NA
"http://qudt.org/vocab/unit/MI_N-PER-HR","Nautical Mile per Hour","http://qudt.org/vocab/dimensionvector/A0E0L1I0M0H0T-1D0",0.514444,"The knot is a unit of speed equal to one nautical mile (1.852 km) per hour, approximately 1.151 mph. The abbreviation kn is preferred by the International Hydrographic Organization (IHO), which includes every major seafaring nation; but the abbreviations kt (singular) and kts (plural) are also widely used conflicting with the SI symbol for kilotonne which is also ""kt"". The knot is a non-SI unit accepted for use with the International System of Units (SI). Worldwide, the knot is used in meteorology, and in maritime and air navigation-for example, a vessel travelling at 1 knot along a meridian travels one minute of geographic latitude in one hour.",NA
"http://qudt.org/vocab/unit/MI_N-PER-MIN","Nautical Mile per Minute","http://qudt.org/vocab/dimensionvector/A0E0L1I0M0H0T-1D0",NA,"The SI derived unit for speed is the meter/second.
1 meter/second is equal to 0.0323974082073 nautical mile per minute.",NA
"http://qudt.org/vocab/unit/MI_US","Mile US Statute","http://qudt.org/vocab/dimensionvector/A0E0L1I0M0H0T0D0",1609.347,"The exact length of the land mile varied slightly among English-speaking countries until the international yard and pound agreement in 1959 established the yard as exactly 0.9144 metres, giving a mile of exactly 1,609.344 metres. The United States adopted this international mile for most purposes, but retained the pre-1959 mile for some land-survey data, terming it the US survey mile. In the US, statute mile formally refers to the survey mile, about 3.219 mm (1/8 inch) longer than the international mile (the international mile is exactly 0.0002\% less than the US survey mile).",NA
"http://qudt.org/vocab/unit/MI2","Square Mile","http://qudt.org/vocab/dimensionvector/A0E0L2I0M0H0T0D0",2589988.11,"The square mile (abbreviated as sq mi and sometimes as mi) is an imperial and US unit of measure for an area equal to the area of a square of one statute mile. It should not be confused with miles square, which refers to the number of miles on each side squared. For instance, 20 miles square (20 × 20 miles) is equal to 400 square miles. One square mile is equivalent to: 4,014,489,600 square inches 27,878,400 square feet, 3,097,600 square yards, 640 acres, 258.9988110336 hectares, 2560 roods, 25,899,881,103.36 square centimetres, 2,589,988.110336 square metres, 2.589988110336 square kilometres When applied to a portion of the earth's surface, which is curved rather than flat, 'square mile' is an informal synonym for section.",NA
"http://qudt.org/vocab/unit/MI3","Cubic Mile","http://qudt.org/vocab/dimensionvector/A0E0L3I0M0H0T0D0",4168181830,"A cubic mile is an imperial / U.S. customary unit of volume, used in the United States, Canada, and the United Kingdom. It is defined as the volume of a cube with sides of 1 mile in length.",NA
"http://qudt.org/vocab/unit/MicroA","microampere","http://qudt.org/vocab/dimensionvector/A0E1L0I0M0H0T0D0",1e-06,NA,NA
"http://qudt.org/vocab/unit/MicroATM","Microatmospheres","http://qudt.org/vocab/dimensionvector/A0E0L-1I0M1H0T-2D0",0.101325,NA,NA
"http://qudt.org/vocab/unit/MicroBAR","Microbar","http://qudt.org/vocab/dimensionvector/A0E0L-1I0M1H0T-2D0",0.1,NA,NA
"http://qudt.org/vocab/unit/MicroBQ","Microbecquerel","http://qudt.org/vocab/dimensionvector/A0E0L0I0M0H0T-1D0",1e-06,NA,NA
"http://qudt.org/vocab/unit/MicroBQ-PER-KiloGM","Microbecquerels per kilogram","http://qudt.org/vocab/dimensionvector/A0E0L0I0M-1H0T-1D0",1e-06,NA,NA
"http://qudt.org/vocab/unit/MicroBQ-PER-L","Microbecquerels per litre","http://qudt.org/vocab/dimensionvector/A0E0L-3I0M0H0T-1D0",0.001,NA,NA
"http://qudt.org/vocab/unit/MicroC","MicroCoulomb","http://qudt.org/vocab/dimensionvector/A0E1L0I0M0H0T1D0",1e-06,NA,"A MicroCoulomb is \(10^{-6} C\)."
"http://qudt.org/vocab/unit/MicroC-PER-M2","Microcoulomb Per Square Meter","http://qudt.org/vocab/dimensionvector/A0E1L-2I0M0H0T1D0",1e-06,NA,NA
"http://qudt.org/vocab/unit/MicroC-PER-M3","Microcoulomb Per Cubic Meter","http://qudt.org/vocab/dimensionvector/A0E1L-3I0M0H0T1D0",1e-06,NA,NA
"http://qudt.org/vocab/unit/MicroCi","MicroCurie","http://qudt.org/vocab/dimensionvector/A0E0L0I0M0H0T-1D0",37000,NA,"Another commonly used measure of radioactivity, the microcurie: \(1 \micro Ci = 3.7 \times 10 disintegrations per second = 2.22 \times 10 disintegrations per minute\). A radiotherapy machine may have roughly 1000 Ci of a radioisotope such as caesium-137 or cobalt-60. This quantity of radioactivity can produce serious health effects with only a few minutes of close-range, un-shielded exposure. The typical human body contains roughly \(0.1\micro Ci\) of naturally occurring potassium-40."
"http://qudt.org/vocab/unit/MicroFARAD","microfarad","http://qudt.org/vocab/dimensionvector/A0E2L-2I0M-1H0T4D0",1e-06,NA,"The ""microfarad"" (symbolized \(\mu F\)) is a unit of capacitance, equivalent to 0.000001 (10 to the -6th power) farad. The microfarad is a moderate unit of capacitance. In utility alternating-current (AC) and audio-frequency (AF) circuits, capacitors with values on the order of \(1 \mu F\) or more are common. At radio frequencies (RF), a smaller unit, the picofarad (pF), is often used."
"http://qudt.org/vocab/unit/MicroFARAD-PER-KiloM","Microfarad Per Kilometer","http://qudt.org/vocab/dimensionvector/A0E2L-3I0M-1H0T4D0",1e-09,NA,NA
"http://qudt.org/vocab/unit/MicroFARAD-PER-M","Microfarad Per Meter","http://qudt.org/vocab/dimensionvector/A0E2L-3I0M-1H0T4D0",1e-06,NA,NA
"http://qudt.org/vocab/unit/MicroG","Microgravity","http://qudt.org/vocab/dimensionvector/A0E0L1I0M0H0T-2D0",9.80665e-06,NA,"""Microgravity"" is a unit for  'Linear Acceleration' expressed as \(microG\)."
