"qudtUri","qudtLabel","qudtDimensionVector","qudtConversionMultiplier","nonLatexDescription","latexDescription"
"http://qudt.org/vocab/unit/NTU","Nephelometry Turbidity Unit","http://qudt.org/vocab/dimensionvector/A0E0L0I0M0H0T0D1",NA,NA,"""Nephelometry Turbidity Unit"" is a C.G.S System unit for  'Turbidity' expressed as \(NTU\)."
"http://qudt.org/vocab/unit/NUM","Number","http://qudt.org/vocab/dimensionvector/A0E0L0I0M0H0T0D1",NA,"""Number"" is a unit for  'Dimensionless' expressed as (\#\).",NA
"http://qudt.org/vocab/unit/NUM-PER-CentiM-KiloYR","Number per square centimetre per thousand years","http://qudt.org/vocab/dimensionvector/A0E0L-1I0M0H0T-1D0",3.1688087814e-07,NA,NA
"http://qudt.org/vocab/unit/NUM-PER-GM","Number per gram","http://qudt.org/vocab/dimensionvector/A0E0L0I0M-1H0T0D0",1000,NA,NA
"http://qudt.org/vocab/unit/NUM-PER-HA","Number per hectare","http://qudt.org/vocab/dimensionvector/A0E0L-2I0M0H0T0D0",1e+06,NA,NA
"http://qudt.org/vocab/unit/NUM-PER-HectoGM","Number per 100 grams","http://qudt.org/vocab/dimensionvector/A0E0L0I0M-1H0T0D0",10,NA,NA
"http://qudt.org/vocab/unit/NUM-PER-HR","Number per individual per hour","http://qudt.org/vocab/dimensionvector/A0E0L0I0M0H0T-1D0",0.00027777777777777,NA,NA
"http://qudt.org/vocab/unit/NUM-PER-KiloM2","Number per square kilometre","http://qudt.org/vocab/dimensionvector/A0E0L-2I0M0H0T0D0",1e-06,NA,NA
"http://qudt.org/vocab/unit/NUM-PER-L","Number per litre","http://qudt.org/vocab/dimensionvector/A0E0L-3I0M0H0T0D0",1000,NA,NA
"http://qudt.org/vocab/unit/NUM-PER-M","Number per metre","http://qudt.org/vocab/dimensionvector/A0E0L-1I0M0H0T0D0",1,NA,NA
"http://qudt.org/vocab/unit/NUM-PER-M2","Number per square metre","http://qudt.org/vocab/dimensionvector/A0E0L-2I0M0H0T0D0",1,NA,NA
"http://qudt.org/vocab/unit/NUM-PER-M2-DAY","Number per square metre per day","http://qudt.org/vocab/dimensionvector/A0E0L-2I0M0H0T-1D0",1.157407407407e-05,NA,NA
"http://qudt.org/vocab/unit/NUM-PER-M3","Number per cubic metre","http://qudt.org/vocab/dimensionvector/A0E0L-3I0M0H0T0D0",1,NA,NA
"http://qudt.org/vocab/unit/NUM-PER-MicroL","Number per microlitre","http://qudt.org/vocab/dimensionvector/A0E0L-3I0M0H0T0D0",1e+09,NA,NA
"http://qudt.org/vocab/unit/NUM-PER-MilliGM","Number per milligram","http://qudt.org/vocab/dimensionvector/A0E0L0I0M-1H0T0D0",1e+06,NA,NA
"http://qudt.org/vocab/unit/NUM-PER-NanoL","Number per nanolitre","http://qudt.org/vocab/dimensionvector/A0E0L-3I0M0H0T0D0",2147483647,NA,NA
"http://qudt.org/vocab/unit/NUM-PER-SEC","Counts per second","http://qudt.org/vocab/dimensionvector/A0E0L0I0M0H0T-1D0",1,NA,NA
"http://qudt.org/vocab/unit/NUM-PER-YR","Number per Year","http://qudt.org/vocab/dimensionvector/A0E0L0I0M0H0T-1D0",3.168808781e-08,NA,"""Number per Year"" is a unit for  'Frequency' expressed as \(\#/yr\)."
"http://qudt.org/vocab/unit/OCT","Oct","http://qudt.org/vocab/dimensionvector/A0E0L0I0M0H0T0D1",NA,NA,"An octave is a doubling or halving of a frequency.  One oct is the logarithmic frequency interval between \(f1\) and \(f2\) when \(f2/f1 = 2\)."
"http://qudt.org/vocab/unit/OERSTED","Oersted","http://qudt.org/vocab/dimensionvector/A0E1L-1I0M0H0T0D0",79.5774715,"Oersted (abbreviated as Oe) is the unit of magnetizing field (also known as H-field, magnetic field strength or intensity) in the CGS system of units.",NA
"http://qudt.org/vocab/unit/OERSTED-CentiM","Oersted Centimeter","http://qudt.org/vocab/dimensionvector/A0E1L0I0M0H0T0D0",0.795774715,NA,"""Oersted Centimeter"" is a C.G.S System unit for  'Magnetomotive Force' expressed as \(Oe-cm\)."
"http://qudt.org/vocab/unit/OHM","Ohm","http://qudt.org/vocab/dimensionvector/A0E-2L2I0M1H0T-3D0",1,NA,"The \textit{ohm} is the SI derived unit of electrical resistance, named after German physicist Georg Simon Ohm. \(\Omega \equiv\ \frac{\text{V}}{\text{A}}\ \equiv\ \frac{\text{volt}}{\text{amp}}\ \equiv\ \frac{\text{W}}{\text {A}^{2}}\ \equiv\ \frac{\text{watt}}{\text{amp}^{2}}\ \equiv\ \frac{\text{H}}{\text {s}}\ \equiv\ \frac{\text{henry}}{\text{second}}\)"
"http://qudt.org/vocab/unit/OHM-M","Ohm Meter","http://qudt.org/vocab/dimensionvector/A0E-2L3I0M1H0T-3D0",1,NA,NA
"http://qudt.org/vocab/unit/OHM-M2-PER-M","Ohm Square Meter per Meter","http://qudt.org/vocab/dimensionvector/A0E-2L3I0M1H0T-3D0",1,NA,NA
"http://qudt.org/vocab/unit/OHM_Ab","Abohm","http://qudt.org/vocab/dimensionvector/A0E-2L2I0M1H0T-3D0",1e-09,NA,"\(\textit{abohm}\) is the basic unit of electrical resistance in the emu-cgs system of units. One abohm is equal to \(10^{-9} ohms\) in the SI system of units; one abohm is a nano ohm."
"http://qudt.org/vocab/unit/OHM_Stat","Statohm","http://qudt.org/vocab/dimensionvector/A0E-2L2I0M1H0T-3D0",8.9876e+11,NA,"""StatOHM"" is the unit of resistance, reactance, and impedance in the electrostatic C.G.S system of units, equal to the resistance between two points of a conductor when a constant potential difference of 1 statvolt between these points produces a current of 1 statampere; it is equal to approximately \(8.9876 \times 10^{11} ohms\). The statohm is an extremely large unit of resistance. In fact, an object with a resistance of 1 stat W would make an excellent insulator or dielectric . In practical applications, the ohm, the kilohm (k W ) and the megohm (M W or M) are most often used to quantify resistance."
"http://qudt.org/vocab/unit/OZ","Ounce Mass","http://qudt.org/vocab/dimensionvector/A0E0L0I0M1H0T0D0",0.028349523125,"An ounce of mass is 1/16th of a pound of mass, based on the international standard definition of the pound as exactly 0.45359237 kg.",NA
"http://qudt.org/vocab/unit/OZ-FT","Ounce (avoirdupois) Foot","http://qudt.org/vocab/dimensionvector/A0E0L1I0M1H0T0D0",0.0086409,NA,NA
"http://qudt.org/vocab/unit/OZ-IN","Ounce (avoirdupois) Inch","http://qudt.org/vocab/dimensionvector/A0E0L1I0M1H0T0D0",0.000694563,NA,NA
"http://qudt.org/vocab/unit/OZ-PER-DAY","Ounce (avoirdupois) Per Day","http://qudt.org/vocab/dimensionvector/A0E0L0I0M1H0T-1D0",3.2812e-07,NA,NA
"http://qudt.org/vocab/unit/OZ-PER-FT2","Imperial Mass Ounce per Square Foot","http://qudt.org/vocab/dimensionvector/A0E0L-2I0M1H0T0D0",0.305151727,NA,"""Ounce per Square Foot"" is an Imperial unit for  'Mass Per Area' expressed as \(oz/ft^{2}\)."
"http://qudt.org/vocab/unit/OZ-PER-GAL","Imperial Mass Ounce per Gallon","http://qudt.org/vocab/dimensionvector/A0E0L-3I0M1H0T0D0",6.23602329,NA,"""Ounce per Gallon"" is an Imperial unit for  'Density' expressed as \(oz/gal\)."
"http://qudt.org/vocab/unit/OZ-PER-GAL_UK","Ounce (avoirdupois) Per Gallon (UK)","http://qudt.org/vocab/dimensionvector/A0E0L-3I0M1H0T0D0",6.236,NA,NA
"http://qudt.org/vocab/unit/OZ-PER-GAL_US","Ounce (avoirdupois) Per Gallon (US)","http://qudt.org/vocab/dimensionvector/A0E0L-3I0M1H0T0D0",7.8125,NA,NA
"http://qudt.org/vocab/unit/OZ-PER-HR","Ounce (avoirdupois) Per Hour","http://qudt.org/vocab/dimensionvector/A0E0L0I0M1H0T-1D0",7.87487e-06,NA,NA
"http://qudt.org/vocab/unit/OZ-PER-IN3","Imperial Mass Ounce per Cubic Inch","http://qudt.org/vocab/dimensionvector/A0E0L-3I0M1H0T0D0",1729.99404,NA,"""Ounce per Cubic Inch"" is an Imperial unit for  'Density' expressed as \(oz/in^{3}\)."
"http://qudt.org/vocab/unit/OZ-PER-MIN","Ounce (avoirdupois) Per Minute","http://qudt.org/vocab/dimensionvector/A0E0L0I0M1H0T-1D0",0.000472492,NA,NA
"http://qudt.org/vocab/unit/OZ-PER-SEC","Ounce (avoirdupois) Per Second","http://qudt.org/vocab/dimensionvector/A0E0L0I0M1H0T-1D0",0.02834952,NA,NA
"http://qudt.org/vocab/unit/OZ-PER-YD2","Imperial Mass Ounce per Square Yard","http://qudt.org/vocab/dimensionvector/A0E0L-2I0M1H0T0D0",0.0339057474748823,NA,"""Ounce per Square Yard"" is an Imperial unit for  'Mass Per Area' expressed as \(oz/yd^{2}\)."
"http://qudt.org/vocab/unit/OZ-PER-YD3","Ounce (avoirdupois) Per Cubic Yard","http://qudt.org/vocab/dimensionvector/A0E0L-3I0M1H0T0D0",0.0370798,NA,NA
"http://qudt.org/vocab/unit/OZ_F","Imperial Ounce Force","http://qudt.org/vocab/dimensionvector/A0E0L1I0M1H0T-2D0",0.278013875,NA,"""Ounce Force"" is an Imperial unit for  'Force' expressed as \(ozf\)."
"http://qudt.org/vocab/unit/OZ_F-IN","Imperial Ounce Force Inch","http://qudt.org/vocab/dimensionvector/A0E0L2I0M1H0T-2D0",0.0706155243,NA,"""Ounce Force Inch"" is an Imperial unit for  'Torque' expressed as \(ozf-in\)."
"http://qudt.org/vocab/unit/OZ_TROY","Ounce Troy","http://qudt.org/vocab/dimensionvector/A0E0L0I0M1H0T0D0",0.0311034768,"An obsolete unit of mass; the Troy Ounce is 1/12th of a Troy Pound. Based on the international definition of a Troy Pound as 5760 grains, the Troy Ounce is exactly 480 grains, or 0.0311034768 kg.",NA
"http://qudt.org/vocab/unit/OZ_VOL_UK","Fluid Ounce (UK)","http://qudt.org/vocab/dimensionvector/A0E0L3I0M0H0T0D0",2.84130625e-05,NA,"\(\textit{Imperial Ounce}\) is an Imperial unit for 'Liquid Volume' expressed as \(oz\)."
"http://qudt.org/vocab/unit/OZ_VOL_UK-PER-DAY","Ounce (UK Fluid) Per Day","http://qudt.org/vocab/dimensionvector/A0E0L3I0M0H0T-1D0",7.87487e-06,NA,NA
"http://qudt.org/vocab/unit/OZ_VOL_UK-PER-HR","Ounce (UK Fluid) Per Hour","http://qudt.org/vocab/dimensionvector/A0E0L3I0M0H0T-1D0",7.87487e-06,NA,NA
"http://qudt.org/vocab/unit/OZ_VOL_UK-PER-MIN","Ounce (UK Fluid) Per Minute","http://qudt.org/vocab/dimensionvector/A0E0L3I0M0H0T-1D0",0.00472492,NA,NA
"http://qudt.org/vocab/unit/OZ_VOL_UK-PER-SEC","Ounce (UK Fluid) Per Second","http://qudt.org/vocab/dimensionvector/A0E0L3I0M0H0T-1D0",2.84e-05,NA,NA
"http://qudt.org/vocab/unit/OZ_VOL_US","US Liquid Ounce","http://qudt.org/vocab/dimensionvector/A0E0L3I0M0H0T0D0",2.95735296e-05,NA,"""US Liquid Ounce"" is a unit for  'Liquid Volume' expressed as \(oz\)."
"http://qudt.org/vocab/unit/OZ_VOL_US-PER-DAY","Ounce (US Fluid) Per Day","http://qudt.org/vocab/dimensionvector/A0E0L3I0M0H0T-1D0",3.42286e-10,NA,NA
"http://qudt.org/vocab/unit/OZ_VOL_US-PER-HR","Ounce (US Fluid) Per Hour","http://qudt.org/vocab/dimensionvector/A0E0L3I0M0H0T-1D0",8.214869e-09,NA,NA
"http://qudt.org/vocab/unit/OZ_VOL_US-PER-MIN","Ounce (US Fluid) Per Minute","http://qudt.org/vocab/dimensionvector/A0E0L3I0M0H0T-1D0",4.92892e-07,NA,NA
"http://qudt.org/vocab/unit/OZ_VOL_US-PER-SEC","Ounce (US Fluid) Per Second","http://qudt.org/vocab/dimensionvector/A0E0L3I0M0H0T-1D0",2.95735296e-05,NA,NA
"http://qudt.org/vocab/unit/PA","Pascal","http://qudt.org/vocab/dimensionvector/A0E0L-1I0M1H0T-2D0",1,"The SI unit of pressure. The pascal is the standard pressure unit in the MKS metric system, equal to one newton per square meter or one ""kilogram per meter per second per second."" The unit is named for Blaise Pascal (1623-1662), French philosopher and mathematician, who was the first person to use a barometer to measure differences in altitude.",NA
"http://qudt.org/vocab/unit/PA-L-PER-SEC","Pascal Liter Per Second","http://qudt.org/vocab/dimensionvector/A0E0L2I0M1H0T-3D0",0.001,NA,NA
"http://qudt.org/vocab/unit/PA-M","Pascal metres","http://qudt.org/vocab/dimensionvector/A0E0L0I0M1H0T-2D0",1,NA,NA
"http://qudt.org/vocab/unit/PA-M-PER-SEC","Pascal metres per second","http://qudt.org/vocab/dimensionvector/A0E0L0I0M1H0T-3D0",1,NA,NA
"http://qudt.org/vocab/unit/PA-M-PER-SEC2","Pascal metres per square second","http://qudt.org/vocab/dimensionvector/A0E0L0I0M1H0T-4D0",1,NA,NA
"http://qudt.org/vocab/unit/PA-M0pt5","Pascal Square Root Meter","http://qudt.org/vocab/dimensionvector/A0E0L-0pt5I0M1H0T-2D0",1,NA,NA
"http://qudt.org/vocab/unit/PA-M3-PER-SEC","Pascal Cubic Meter Per Second","http://qudt.org/vocab/dimensionvector/A0E0L2I0M1H0T-3D0",1,NA,NA
"http://qudt.org/vocab/unit/PA-PER-BAR","Pascal Per Bar","http://qudt.org/vocab/dimensionvector/A0E0L0I0M0H0T0D1",1e-05,NA,NA
"http://qudt.org/vocab/unit/PA-PER-HR","Pascal per Hour","http://qudt.org/vocab/dimensionvector/A0E0L-1I0M1H0T-3D0",0.000277777778,"A rate of change of pressure measured as the number of Pascals in a period of one hour.",NA
"http://qudt.org/vocab/unit/PA-PER-K","Pascal per Kelvin","http://qudt.org/vocab/dimensionvector/A0E0L-1I0M1H-1T-2D0",NA,NA,NA
"http://qudt.org/vocab/unit/PA-PER-M","Pascal Per Meter","http://qudt.org/vocab/dimensionvector/A0E0L-2I0M1H0T-2D0",1,NA,NA
"http://qudt.org/vocab/unit/PA-PER-MIN","Pascal per Minute","http://qudt.org/vocab/dimensionvector/A0E0L-1I0M1H0T-3D0",0.0166666667,"A rate of change of pressure measured as the number of Pascals in a period of one minute.",NA
"http://qudt.org/vocab/unit/PA-PER-SEC","Pascal per Second","http://qudt.org/vocab/dimensionvector/A0E0L-1I0M1H0T-3D0",1,"A rate of change of pressure measured as the number of Pascals in a period of one second.",NA
"http://qudt.org/vocab/unit/PA-SEC","Pascal Second","http://qudt.org/vocab/dimensionvector/A0E0L-1I0M1H0T-1D0",1,"The SI unit of dynamic viscosity, equal to 10 poises or 1000 centipoises.",NA
"http://qudt.org/vocab/unit/PA-SEC-PER-BAR","Pascal Second Per Bar","http://qudt.org/vocab/dimensionvector/A0E0L0I0M0H0T1D0",1e-05,NA,NA
"http://qudt.org/vocab/unit/PA-SEC-PER-M","Pascal Second Per Meter","http://qudt.org/vocab/dimensionvector/A0E0L-2I0M1H0T-1D0",1,NA,"Pascal Second Per Meter (\(Pa-s/m\)) is a unit in the category of Specific acoustic impedance. It is also known as pascal-second/meter. Pascal Second Per Meter has a dimension of \(ML^2T^{-1}\) where M is mass, L is length, and T is time. It essentially the same as the corresponding standard SI unit \(kg/m2\cdot s\)."
"http://qudt.org/vocab/unit/PA-SEC-PER-M3","Pascal Second Per Cubic Meter","http://qudt.org/vocab/dimensionvector/A0E0L-4I0M1H0T-1D0",1,NA,"\(\textit{Pascal Second Per Cubic Meter}\) (\(Pa-s/m^3\)) is a unit in the category of Acoustic impedance. It is also known as \(\textit{pascal-second/cubic meter}\). It has a dimension of \(ML^{-4}T^{-1}\) where \(M\) is mass, \(L\) is length, and \(T\) is time. This unit is the standard SI unit in this category."
"http://qudt.org/vocab/unit/PA2-PER-SEC2","Square pascal per square second","http://qudt.org/vocab/dimensionvector/A0E0L-2I0M2H0T-6D0",1,NA,NA
"http://qudt.org/vocab/unit/PA2-SEC","Square Pascal Second","http://qudt.org/vocab/dimensionvector/A0E0L-2I0M2H0T-3D0",1,NA,"Square Pascal Second (\(Pa^2\cdot s\)) is a unit in the category of sound exposure."
"http://qudt.org/vocab/unit/PARSEC","Parsec","http://qudt.org/vocab/dimensionvector/A0E0L1I0M0H0T0D0",3.085678e+16,NA,"The parsec (parallax of one arcsecond; symbol: pc) is a unit of length, equal to just under 31 trillion (\(31 \times 10^{12}\)) kilometres (about 19 trillion miles), 206265 AU, or about 3.26 light-years. The parsec measurement unit is used in astronomy. It is defined as the length of the adjacent side of an imaginary right triangle in space. The two dimensions that specify this triangle are the parallax angle (defined as 1 arcsecond) and the opposite side (defined as 1 astronomical unit (AU), the distance from the Earth to the Sun). Given these two measurements, along with the rules of trigonometry, the length of the adjacent side (the parsec) can be found."
"http://qudt.org/vocab/unit/PCA","Pica","http://qudt.org/vocab/dimensionvector/A0E0L1I0M0H0T0D0",0.0042333,"A pica is a typographic unit of measure corresponding to 1/72 of its respective foot, and therefore to 1/6 of an inch. The pica contains 12 point units of measure. Notably, Adobe PostScript promoted the pica unit of measure that is the standard in contemporary printing, as in home computers and printers. Usually, pica measurements are represented with an upper-case 'P' with an upper-right-to-lower-left virgule (slash) starting in the upper right portion of the 'P' and ending at the lower left of the upright portion of the 'P'; essentially drawing a virgule (/) through a 'P'.  Note that these definitions are different from a typewriter's pica setting, which denotes a type size of ten characters per horizontal inch.",NA
"http://qudt.org/vocab/unit/PDL","Poundal","http://qudt.org/vocab/dimensionvector/A0E0L1I0M1H0T-2D0",0.138254954376,NA,"The poundal is a unit of force that is part of the foot-pound-second system of units, in Imperial units introduced in 1877, and is from the specialized subsystem of English absolute (a coherent system). The poundal is defined as the force necessary to accelerate 1 pound-mass to 1 foot per second per second. \(1 pdl = 0.138254954376 N\) exactly."
"http://qudt.org/vocab/unit/PDL-PER-FT2","Poundal per Square Foot","http://qudt.org/vocab/dimensionvector/A0E0L-1I0M1H0T-2D0",1.48816443,NA,"Poundal Per Square Foot (\(pdl/ft^2\)) is a unit in the category of Pressure. It is also known as poundals per square foot, poundal/square foot. This unit is commonly used in the UK, US unit systems. Poundal Per Square Foot has a dimension of \(ML^{-1}T^{-2}\), where M is mass, L is length, and T is time. It can be converted to the corresponding standard SI unit \si{Pa} by multiplying its value by a factor of 1.488163944."
"http://qudt.org/vocab/unit/PebiBYTE","PebiByte","http://qudt.org/vocab/dimensionvector/A0E0L0I0M0H0T0D1",6243314768165359,NA,"The pebibyte is a standards-based binary multiple (prefix pebi, symbol Pi) of the byte, a unit of digital information storage. The pebibyte unit symbol is PiB. 1 pebibyte =  1125899906842624bytes = 1024 tebibytes The pebibyte is closely related to the petabyte, which is defined as \(10^{15} bytes = 1,000,000,000,000,000 bytes\)."
"http://qudt.org/vocab/unit/Pennyweight","Pennyweight","http://qudt.org/vocab/dimensionvector/A0E0L0I0M1H0T0D0",0.001555174,NA,NA
"http://qudt.org/vocab/unit/PER-ANGSTROM","Reciprocal Ã¥ngstrÃ¶m","http://qudt.org/vocab/dimensionvector/A0E0L-1I0M0H0T0D0",1e-10,NA,NA
"http://qudt.org/vocab/unit/PER-BAR","Reciprocal Bar","http://qudt.org/vocab/dimensionvector/A0E0L1I0M-1H0T2D0",1e-05,NA,NA
"http://qudt.org/vocab/unit/PER-CentiM","Reciprocal Centimeter","http://qudt.org/vocab/dimensionvector/A0E0L-1I0M0H0T0D0",100,NA,NA
"http://qudt.org/vocab/unit/PER-CentiM3","Reciprocal Cubic Centimeter","http://qudt.org/vocab/dimensionvector/A0E0L-3I0M0H0T0D0",1e+06,NA,NA
"http://qudt.org/vocab/unit/PER-DAY","Reciprocal Day","http://qudt.org/vocab/dimensionvector/A0E0L0I0M0H0T-1D0",1.157407e-05,NA,NA
"http://qudt.org/vocab/unit/PER-EV2","Reciprocal Square Electron Volt","http://qudt.org/vocab/dimensionvector/A0E0L-4I0M-2H0T4D0",3.89564405e+37,NA,"Per Square Electron Volt is a denominator unit with dimensions \(/eV^2\)."
"http://qudt.org/vocab/unit/PER-FT3","Reciprocal Cubic Foot","http://qudt.org/vocab/dimensionvector/A0E0L-3I0M0H0T0D0",35.31466,NA,NA
"http://qudt.org/vocab/unit/PER-GigaEV2","Reciprocal Square Giga Electron Volt Unit","http://qudt.org/vocab/dimensionvector/A0E0L-4I0M-2H0T4D0",3.89564405e+19,NA,"Per Square Giga Electron Volt Unit is a denominator unit with dimensions \(/GeV^2\)."
"http://qudt.org/vocab/unit/PER-GM","Reciprocal gram","http://qudt.org/vocab/dimensionvector/A0E0L0I0M-1H0T0D0",1000,NA,NA
"http://qudt.org/vocab/unit/PER-H","Reciprocal Henry","http://qudt.org/vocab/dimensionvector/A0E2L-2I0M-1H0T2D0",1,NA,NA
"http://qudt.org/vocab/unit/PER-HR","Reciprocal Hour","http://qudt.org/vocab/dimensionvector/A0E0L0I0M0H0T-1D0",360,NA,"A reciprocal unit of time for \(\textit{reciprocal hour}\) or ""inverse hour""."
"http://qudt.org/vocab/unit/PER-IN3","Reciprocal Cubic Inch","http://qudt.org/vocab/dimensionvector/A0E0L-3I0M0H0T0D0",61023.76,NA,NA
"http://qudt.org/vocab/unit/PER-J-M3","Reciprocal Joule Cubic Meter","http://qudt.org/vocab/dimensionvector/A0E0L1I0M-1H0T2D0",1,NA,NA
"http://qudt.org/vocab/unit/PER-J2","Reciprocal Square Joule","http://qudt.org/vocab/dimensionvector/A0E0L-4I0M-2H0T4D0",1,NA,"Per Square Joule is a denominator unit with dimensions \(/eV^2\)."
"http://qudt.org/vocab/unit/PER-K","Reciprocal Kelvin","http://qudt.org/vocab/dimensionvector/A0E0L0I0M0H-1T0D0",1,NA,"Per Kelvin Unit is a denominator unit with dimensions \(/k\)."
"http://qudt.org/vocab/unit/PER-KiloGM2","Reciprocal Square Kilogram","http://qudt.org/vocab/dimensionvector/A0E0L0I0M-2H0T0D0",1,NA,"Per Square Kilogram is a denominator unit with dimensions \(/kg^2\)."
"http://qudt.org/vocab/unit/PER-KiloM","Reciprocal Kilometer","http://qudt.org/vocab/dimensionvector/A0E0L-1I0M0H0T0D0",0.001,NA,"Per Kilometer Unit is a denominator unit with dimensions \(/km\)."
"http://qudt.org/vocab/unit/PER-KiloV-A-HR","Reciprocal Kilovolt Ampere Hour","http://qudt.org/vocab/dimensionvector/A0E0L-2I0M-1H0T2D0",0.001,NA,NA
"http://qudt.org/vocab/unit/PER-L","Reciprocal Liter","http://qudt.org/vocab/dimensionvector/A0E0L-3I0M0H0T0D0",1000,NA,NA
"http://qudt.org/vocab/unit/PER-M","Reciprocal Meter","http://qudt.org/vocab/dimensionvector/A0E0L-1I0M0H0T0D0",1,NA,"Per Meter Unit is a denominator unit with dimensions \(/m\)."
"http://qudt.org/vocab/unit/PER-M-K","Reciprocal Meter Kelvin","http://qudt.org/vocab/dimensionvector/A0E0L-1I0M0H-1T0D0",1,NA,"Per Meter Kelvin Unit is a denominator unit with dimensions \(/m.k\)."
"http://qudt.org/vocab/unit/PER-M-NanoM","Reciprocal metre per nanometre","http://qudt.org/vocab/dimensionvector/A0E0L-2I0M0H0T0D0",1e+09,NA,NA
"http://qudt.org/vocab/unit/PER-M-NanoM-SR","Reciprocal metre per nanometre per steradian","http://qudt.org/vocab/dimensionvector/A0E0L-2I0M0H0T0D0",1e+09,NA,NA
"http://qudt.org/vocab/unit/PER-M-SEC","Reciprocal metre per second","http://qudt.org/vocab/dimensionvector/A0E0L-1I0M0H0T-1D0",1,NA,NA
"http://qudt.org/vocab/unit/PER-M-SR","Reciprocal metre per steradian","http://qudt.org/vocab/dimensionvector/A0E0L-1I0M0H0T0D0",1,NA,NA
"http://qudt.org/vocab/unit/PER-M2","Reciprocal Square Meter","http://qudt.org/vocab/dimensionvector/A0E0L-2I0M0H0T0D0",1,NA,"""Per Square Meter"" is a denominator unit with dimensions \(/m^2\)."
"http://qudt.org/vocab/unit/PER-M2-SEC","Reciprocal Square Meter Second","http://qudt.org/vocab/dimensionvector/A0E0L-2I0M0H0T-1D0",1,NA,NA
"http://qudt.org/vocab/unit/PER-M3","Reciprocal Cubic Meter","http://qudt.org/vocab/dimensionvector/A0E0L-3I0M0H0T0D0",1,NA,"""Per Cubic Meter"" is a denominator unit with dimensions \(/m^3\)."
"http://qudt.org/vocab/unit/PER-M3-SEC","Reciprocal Cubic Meter Second","http://qudt.org/vocab/dimensionvector/A0E0L-3I0M0H0T-1D0",1,NA,NA
"http://qudt.org/vocab/unit/PER-MicroM","Reciprocal Micrometer","http://qudt.org/vocab/dimensionvector/A0E0L-1I0M0H0T0D0",1e+06,NA,"Per Micrometer Unit is a denominator unit with dimensions \(/microm\)."
"http://qudt.org/vocab/unit/PER-MicroMOL-L","Reciprocal micromole per litre","http://qudt.org/vocab/dimensionvector/A-1E0L-3I0M0H0T0D0",1e+09,NA,NA
"http://qudt.org/vocab/unit/PER-MILLE-PER-PSI","Reciprocal Mille Per Psi","http://qudt.org/vocab/dimensionvector/A0E0L1I0M-1H0T2D0",1.450377e-07,NA,NA
"http://qudt.org/vocab/unit/PER-MilliM","Reciprocal Millimeter","http://qudt.org/vocab/dimensionvector/A0E0L-1I0M0H0T0D0",1000,NA,"Per Millimeter Unit is a denominator unit with dimensions \(/mm\)."
"http://qudt.org/vocab/unit/PER-MilliM3","Reciprocal Cubic Millimeter","http://qudt.org/vocab/dimensionvector/A0E0L-3I0M0H0T0D0",1e+09,NA,NA
"http://qudt.org/vocab/unit/PER-MilliSEC","Reciprocal millisecond","http://qudt.org/vocab/dimensionvector/A0E0L0I0M0H0T-1D0",1000,NA,NA
"http://qudt.org/vocab/unit/PER-MIN","Reciprocal Minute","http://qudt.org/vocab/dimensionvector/A0E0L0I0M0H0T-1D0",60,NA,"A reciprocal unit of time for \(\textit{reciprocal minute}\) or \(\textit{inverse minute}\)."
"http://qudt.org/vocab/unit/PER-MO","Reciprocal Month","http://qudt.org/vocab/dimensionvector/A0E0L0I0M0H0T-1D0",3.91935077e-07,NA,NA
"http://qudt.org/vocab/unit/PER-MOL","Reciprocal Mole","http://qudt.org/vocab/dimensionvector/A-1E0L0I0M0H0T0D0",1,NA,"<p><strong>Per Mole Unit</strong> is a denominator unit with dimensions \(mol^{-1}\)</p>."
"http://qudt.org/vocab/unit/PER-NanoM","Reciprocal Nanometer","http://qudt.org/vocab/dimensionvector/A0E0L-1I0M0H0T0D0",1e+09,NA,"Per Nanometer Unit is a denominator unit with dimensions \(/nm\)."
"http://qudt.org/vocab/unit/PER-PA","Reciprocal Pascal","http://qudt.org/vocab/dimensionvector/A0E0L1I0M-1H0T2D0",1,NA,NA
"http://qudt.org/vocab/unit/PER-PA-SEC","Reciprocal Pascal per second","http://qudt.org/vocab/dimensionvector/A0E0L1I0M-1H0T1D0",1,NA,NA
"http://qudt.org/vocab/unit/PER-PicoM","Reciprocal Picometer","http://qudt.org/vocab/dimensionvector/A0E0L-1I0M0H0T0D0",1e+12,NA,"Per Picoometer Unit is a denominator unit with dimensions \(/pm\)."
"http://qudt.org/vocab/unit/PER-PlanckMass2","Inverse Square Planck Mass","http://qudt.org/vocab/dimensionvector/A0E0L0I0M-2H0T0D0",2.111089e+15,NA,"In physics, the Planck mass, denoted by \(m_P\), is the unit of mass in the system of natural units known as Planck units. It is defined so that \(\approx  1.2209 \times 10 GeV/c_0 = 2.17651(13) \times 10 kg\), (or \(21.7651 \mu g\)), where \(c_0\) is the speed of light in a vacuum, \(G\) is the gravitational constant, and \(\hbar\) is the reduced Planck constant. Particle physicists and cosmologists often use the reduced Planck mass, which is \(\approx  4.341 \times 10 kg = 2.435  \times 10 GeV/c\). The added factor of \(1/{\sqrt{8\pi}}\) simplifies a number of equations in general relativity. Quantum effects are typified by the magnitude of Planck's constant."
"http://qudt.org/vocab/unit/PER-PSI","Reciprocal Psi","http://qudt.org/vocab/dimensionvector/A0E0L1I0M-1H0T2D0",0.0001450377,NA,NA
"http://qudt.org/vocab/unit/PER-SEC","Reciprocal Second","http://qudt.org/vocab/dimensionvector/A0E0L0I0M0H0T-1D0",1,NA,"A reciprical unit of time for \(\textit{reciprocal second}\) or \(\textit{inverse second}\). The \(\textit{Per Second}\) is a unit of rate."
"http://qudt.org/vocab/unit/PER-SEC-M2","Reciprocal Second Square Meter","http://qudt.org/vocab/dimensionvector/A0E0L-2I0M0H0T-1D0",1,NA,"\(\textit{Per Second Square Meter}\) is a measure of flux with dimensions \(/sec-m^2\)."
