"qudtUri","qudtLabel","qudtDimensionVector","qudtConversionMultiplier","nonLatexDescription","latexDescription"
"http://qudt.org/vocab/unit/FR","Franklin","http://qudt.org/vocab/dimensionvector/A0E1L0I0M0H0T1D0",3.335641e-10,NA,"""Franklin"" is a unit for  'Electric Charge' expressed as \(Fr\)."
"http://qudt.org/vocab/unit/FRACTION","Fraction","http://qudt.org/vocab/dimensionvector/A0E0L0I0M0H0T0D1",1,NA,NA
"http://qudt.org/vocab/unit/FRAME-PER-SEC","Frame per Second","http://qudt.org/vocab/dimensionvector/A0E0L0I0M0H0T-1D0",NA,NA,"""Frame per Second"" is a unit for  'Video Frame Rate' expressed as \(fps\)."
"http://qudt.org/vocab/unit/FT","Foot","http://qudt.org/vocab/dimensionvector/A0E0L1I0M0H0T0D0",0.3048,"A foot is a unit of length defined as being 0.3048 m exactly and used in the imperial system of units and United States customary units. It is subdivided into 12 inches. The foot is still officially used in Canada and still commonly used in the United Kingdom, although the latter has partially metricated its units of measurement.",NA
"http://qudt.org/vocab/unit/FT-LA","Foot Lambert","http://qudt.org/vocab/dimensionvector/A0E0L-2I1M0H0T0D0",3.4262591,NA,"""Foot Lambert"" is a C.G.S System unit for  'Luminance' expressed as \(ft-L\)."
"http://qudt.org/vocab/unit/FT-LB_F","Foot Pound Force","http://qudt.org/vocab/dimensionvector/A0E0L2I0M1H0T-2D0",1.35581807,NA,"""Foot Pound Force"" is an Imperial unit for  'Energy And Work' expressed as \(ft-lbf\)."
"http://qudt.org/vocab/unit/FT-LB_F-PER-FT2","Foot Pound per Square Foot","http://qudt.org/vocab/dimensionvector/A0E0L0I0M1H0T-2D0",14.5939042,NA,"""Foot Pound per Square Foot"" is an Imperial unit for  'Energy Per Area' expressed as \(ft-lbf/ft^{2}\)."
"http://qudt.org/vocab/unit/FT-LB_F-PER-FT2-SEC","Foot Pound Force per Square Foot Second","http://qudt.org/vocab/dimensionvector/A0E0L0I0M1H0T-3D0",14.5939042,NA,"""Foot Pound Force per Square Foot Second"" is an Imperial unit for  'Power Per Area' expressed as \(ft \cdot lbf/(ft^2 \cdot s)\)."
"http://qudt.org/vocab/unit/FT-LB_F-PER-HR","Foot Pound Force per Hour","http://qudt.org/vocab/dimensionvector/A0E0L2I0M1H0T-3D0",0.00376616129,NA,"""Foot Pound Force per Hour"" is an Imperial unit for  'Power' expressed as \(ft-lbf/hr\)."
"http://qudt.org/vocab/unit/FT-LB_F-PER-M2","Foot Pound Force per Square Meter","http://qudt.org/vocab/dimensionvector/A0E0L0I0M1H0T-2D0",NA,NA,"""Foot Pound Force per Square Meter"" is a unit for  'Energy Per Area' expressed as \(ft-lbf/m^{2}\)."
"http://qudt.org/vocab/unit/FT-LB_F-PER-MIN","Foot Pound Force per Minute","http://qudt.org/vocab/dimensionvector/A0E0L2I0M1H0T-3D0",0.0225969678,NA,"""Foot Pound Force per Minute"" is an Imperial unit for  'Power' expressed as \(ft-lbf/min\)."
"http://qudt.org/vocab/unit/FT-LB_F-PER-SEC","Foot Pound Force per Second","http://qudt.org/vocab/dimensionvector/A0E0L2I0M1H0T-3D0",1.35581807,NA,"""Foot Pound Force per Second"" is an Imperial unit for  'Power' expressed as \(ft-lbf/s\)."
"http://qudt.org/vocab/unit/FT-LB_F-SEC","Foot Pound Force Second","http://qudt.org/vocab/dimensionvector/A0E0L2I0M1H0T-1D0",NA,NA,"""Foot Pound Force Second"" is a unit for  'Angular Momentum' expressed as \(lbf / s\)."
"http://qudt.org/vocab/unit/FT-PDL","Foot Poundal","http://qudt.org/vocab/dimensionvector/A0E0L2I0M1H0T-2D0",0.0421401100938048,NA,"""Foot Poundal"" is an Imperial unit for  'Energy And Work' expressed as \(ft-pdl\)."
"http://qudt.org/vocab/unit/FT-PER-DAY","Foot per Day","http://qudt.org/vocab/dimensionvector/A0E0L1I0M0H0T-1D0",3.52777777777e-06,NA,"""Foot per Day"" is an Imperial unit for  'Linear Velocity' expressed as \(ft/d\)."
"http://qudt.org/vocab/unit/FT-PER-DEG_F","Foot Per Degree Fahrenheit","http://qudt.org/vocab/dimensionvector/A0E0L1I0M0H-1T0D0",0.54864,NA,NA
"http://qudt.org/vocab/unit/FT-PER-HR","Foot per Hour","http://qudt.org/vocab/dimensionvector/A0E0L1I0M0H0T-1D0",8.466666666666e-05,NA,"""Foot per Hour"" is an Imperial unit for  'Linear Velocity' expressed as \(ft/hr\)."
"http://qudt.org/vocab/unit/FT-PER-MIN","Foot per Minute","http://qudt.org/vocab/dimensionvector/A0E0L1I0M0H0T-1D0",0.00508,NA,"""Foot per Minute"" is an Imperial unit for  'Linear Velocity' expressed as \(ft/min\)."
"http://qudt.org/vocab/unit/FT-PER-SEC","Foot per Second","http://qudt.org/vocab/dimensionvector/A0E0L1I0M0H0T-1D0",0.3048,NA,"\(\textit{foot per second}\) (plural \(\textit{feet per second}\)) is a unit of both speed (scalar) and velocity (vector quantity, which includes direction). It expresses the distance in feet (\(ft\)) traveled or displaced, divided by the time in seconds (\(s\), or \(sec\)). The corresponding unit in the International System of Units (SI) is the \(\textit{metre per second}\). Abbreviations include \(ft/s\), \(ft/sec\) and \(fps\), and the rarely used scientific notation \(ft\,s\)."
"http://qudt.org/vocab/unit/FT-PER-SEC2","Foot per Square Second","http://qudt.org/vocab/dimensionvector/A0E0L1I0M0H0T-2D0",0.3048,NA,"\(\textit{Foot per Square Second}\) is an Imperial unit for \(\textit{Linear Acceleration}\) expressed as \(ft/s^2\)."
"http://qudt.org/vocab/unit/FT_H2O","Foot of Water","http://qudt.org/vocab/dimensionvector/A0E0L-1I0M1H0T-2D0",2989.067,NA,"""Foot of Water"" is a unit for  'Force Per Area' expressed as \(ftH2O\)."
"http://qudt.org/vocab/unit/FT_HG","Foot Of Mercury","http://qudt.org/vocab/dimensionvector/A0E0L-1I0M1H0T-2D0",40636.66,NA,NA
"http://qudt.org/vocab/unit/FT_US","US Survey Foot","http://qudt.org/vocab/dimensionvector/A0E0L1I0M0H0T0D0",0.3048006,NA,"\(\textit{US Survey Foot}\) is a unit for 'Length' expressed as \(ftUS\)."
"http://qudt.org/vocab/unit/FT2","Square Foot","http://qudt.org/vocab/dimensionvector/A0E0L2I0M0H0T0D0",0.09290304,NA,"The square foot (plural square feet; abbreviated \(ft^2\) or \(sq \, ft\)) is an imperial unit and U.S. customary unit of area, used mainly in the United States, Canada, United Kingdom, Hong Kong, Bangladesh, India, Pakistan and Afghanistan. It is defined as the area of a square with sides of 1 foot in length."
"http://qudt.org/vocab/unit/FT2-DEG_F","Square Foot Degree Fahrenheit","http://qudt.org/vocab/dimensionvector/A0E0L2I0M0H1T0D0",NA,NA,"\(\textbf{Square Foot Degree Fahrenheit} is an Imperial unit for 'Area Temperature' expressed as \(ft^{2}-degF\)."
"http://qudt.org/vocab/unit/FT2-HR-DEG_F","Square Foot Hour Degree Fahrenheit","http://qudt.org/vocab/dimensionvector/A0E0L2I0M0H1T1D0",NA,NA,"\(\textbf{Square Foot Hour Degree Fahrenheit} is an Imperial unit for 'Area Time Temperature' expressed as \(ft^{2}-hr-degF\)."
"http://qudt.org/vocab/unit/FT2-HR-DEG_F-PER-BTU_IT","Square Foot Hour Degree Fahrenheit per BTU","http://qudt.org/vocab/dimensionvector/A0E0L0I0M-1H1T3D0",NA,NA,"\(\textbf{Square Foot Hour Degree Fahrenheit per BTU} is an Imperial unit for 'Thermal Insulance' expressed as \((degF-hr-ft^{2})/Btu\)."
"http://qudt.org/vocab/unit/FT2-PER-BTU_IT-IN","Square Foot per BTU Inch","http://qudt.org/vocab/dimensionvector/A0E0L-1I0M-1H1T3D0",0.00346673589,NA,NA
"http://qudt.org/vocab/unit/FT2-PER-HR","Square Foot per Hour","http://qudt.org/vocab/dimensionvector/A0E0L2I0M0H0T-1D0",2.58064e-05,NA,"\(\textbf{Square Foot per Hour} is an Imperial unit for \(\textit{Kinematic Viscosity}\) and  \(\textit{Thermal Diffusivity}\) expressed as \(ft^{2}/hr\)."
"http://qudt.org/vocab/unit/FT2-PER-SEC","Square Foot per Second","http://qudt.org/vocab/dimensionvector/A0E0L2I0M0H0T-1D0",0.09290304,NA,"""Square Foot per Second"" is an Imperial unit for  'Kinematic Viscosity' expressed as \(ft^{2}/s\)."
"http://qudt.org/vocab/unit/FT2-SEC-DEG_F","Square Foot Second Degree Fahrenheit","http://qudt.org/vocab/dimensionvector/A0E0L2I0M0H1T1D0",NA,NA,"\(\textbf{Square Foot Second Degree Fahrenheit} is an Imperial unit for 'Area Time Temperature' expressed as \(ft^{2}\cdot s\cdot degF\)."
"http://qudt.org/vocab/unit/FT3","Cubic Foot","http://qudt.org/vocab/dimensionvector/A0E0L3I0M0H0T0D0",0.028316846592,"The cubic foot is an Imperial and US customary unit of volume, used in the United States and the United Kingdom. It is defined as the volume of a cube with sides of one foot (0.3048 m) in length. To calculate cubic feet multiply length X width X height.",NA
"http://qudt.org/vocab/unit/FT3-PER-DAY","Cubic Foot Per Day","http://qudt.org/vocab/dimensionvector/A0E0L3I0M0H0T-1D0",3.277413e-07,NA,NA
"http://qudt.org/vocab/unit/FT3-PER-DEG_F","Cubic Foot Per Degree Fahrenheit","http://qudt.org/vocab/dimensionvector/A0E0L3I0M0H-1T0D0",0.05097033,NA,NA
"http://qudt.org/vocab/unit/FT3-PER-HR","Cubic Foot Per Hour","http://qudt.org/vocab/dimensionvector/A0E0L3I0M0H0T-1D0",7.865792e-06,NA,NA
"http://qudt.org/vocab/unit/FT3-PER-MIN","Cubic Foot per Minute","http://qudt.org/vocab/dimensionvector/A0E0L3I0M0H0T-1D0",0.0004719474432,NA,"""Cubic Foot per Minute"" is an Imperial unit for  'Volume Per Unit Time' expressed as \(ft^3/min\)."
"http://qudt.org/vocab/unit/FT3-PER-MIN-FT2","Cubic Foot Per Minute Square Foot","http://qudt.org/vocab/dimensionvector/A0E0L1I0M0H0T-1D0",0.00508,NA,NA
"http://qudt.org/vocab/unit/FT3-PER-SEC","Cubic Foot per Second","http://qudt.org/vocab/dimensionvector/A0E0L3I0M0H0T-1D0",0.028316846592,NA,"""Cubic Foot per Second"" is an Imperial unit for \( \textit{Volume Per Unit Time}\) expressed as \(ft^3/s\)."
"http://qudt.org/vocab/unit/FUR","Furlong","http://qudt.org/vocab/dimensionvector/A0E0L1I0M0H0T0D0",201.168,"A furlong is a measure of distance in imperial units and U.S. customary units equal to one-eighth of a mile, equivalent to 220 yards, 660 feet, 40 rods, or 10 chains. The exact value of the furlong varies slightly among English-speaking countries. Five furlongs are approximately 1 kilometre (1.0058 km is a closer approximation). Since the original definition of the metre was one-quarter of one ten-millionth of the circumference of the Earth (along the great circle coincident with the meridian of longitude passing through Paris), the circumference of the Earth is about 40,000 km or about 200,000 furlongs.",NA
"http://qudt.org/vocab/unit/FUR_Long","Long Furlong","http://qudt.org/vocab/dimensionvector/A0E0L1I0M0H0T0D0",NA,NA,NA
"http://qudt.org/vocab/unit/G","Gravity","http://qudt.org/vocab/dimensionvector/A0E0L1I0M0H0T-2D0",9.80665,NA,"""Gravity"" is a unit for  'Linear Acceleration' expressed as \(G\)."
"http://qudt.org/vocab/unit/GAL_IMP","Imperial Gallon","http://qudt.org/vocab/dimensionvector/A0E0L3I0M0H0T0D0",0.00454609,NA,"""Imperial Gallon"" is an Imperial unit for  'Liquid Volume' expressed as \(galIMP\)."
"http://qudt.org/vocab/unit/GAL_UK","Gallon (UK)","http://qudt.org/vocab/dimensionvector/A0E0L3I0M0H0T0D0",0.00454609,NA,NA
"http://qudt.org/vocab/unit/GAL_UK-PER-DAY","Gallon (UK) Per Day","http://qudt.org/vocab/dimensionvector/A0E0L3I0M0H0T-1D0",5.261678e-08,NA,NA
"http://qudt.org/vocab/unit/GAL_UK-PER-HR","Gallon (UK) Per Hour","http://qudt.org/vocab/dimensionvector/A0E0L3I0M0H0T-1D0",1.262803e-06,NA,NA
"http://qudt.org/vocab/unit/GAL_UK-PER-MIN","Gallon (UK) Per Minute","http://qudt.org/vocab/dimensionvector/A0E0L3I0M0H0T-1D0",7.576817e-05,NA,NA
"http://qudt.org/vocab/unit/GAL_UK-PER-SEC","Gallon (UK) Per Second","http://qudt.org/vocab/dimensionvector/A0E0L3I0M0H0T-1D0",0.00454609,NA,NA
"http://qudt.org/vocab/unit/GAL_US","US Gallon","http://qudt.org/vocab/dimensionvector/A0E0L3I0M0H0T0D0",0.003785412,NA,"""US Gallon"" is a unit for  'Liquid Volume' expressed as \(galUS\)."
"http://qudt.org/vocab/unit/GAL_US-PER-DAY","US Gallon per Day","http://qudt.org/vocab/dimensionvector/A0E0L3I0M0H0T-1D0",4.38126389e-08,NA,"""US Gallon per Day"" is a unit for  'Volume Per Unit Time' expressed as \(gal/d\)."
"http://qudt.org/vocab/unit/GAL_US-PER-HR","Gallon (US) Per Hour","http://qudt.org/vocab/dimensionvector/A0E0L3I0M0H0T-1D0",1.051503e-06,NA,NA
"http://qudt.org/vocab/unit/GAL_US-PER-MIN","US Gallon per Minute","http://qudt.org/vocab/dimensionvector/A0E0L3I0M0H0T-1D0",6.30902e-05,NA,"""US Gallon per Minute"" is a C.G.S System unit for  'Volume Per Unit Time' expressed as \(gal/min\)."
"http://qudt.org/vocab/unit/GAL_US-PER-SEC","Gallon (US Liquid) Per Second","http://qudt.org/vocab/dimensionvector/A0E0L3I0M0H0T-1D0",0.003785412,NA,NA
"http://qudt.org/vocab/unit/GAL_US_DRY","Dry Gallon US","http://qudt.org/vocab/dimensionvector/A0E0L3I0M0H0T0D0",0.00440488377,NA,"""Dry Gallon US"" is a unit for  'Dry Volume' expressed as \(dry_gal\)."
"http://qudt.org/vocab/unit/GALILEO","Galileo","http://qudt.org/vocab/dimensionvector/A0E0L1I0M0H0T-2D0",0.01,NA,"The \(\textit{Galileo}\) is the unit of acceleration of free fall used extensively in the science of gravimetry. The Galileo is defined as \(1 \textit{centimeter per square second}\) (\(1 cm/s^2\)). Unfortunately, the Galileo is often denoted with the symbol Gal, not to be confused with the Gallon that also uses the same symbol."
"http://qudt.org/vocab/unit/Gamma","Gamma","http://qudt.org/vocab/dimensionvector/A0E-1L0I0M1H0T-2D0",1e-09,"""Gamma"" is a C.G.S System unit for  'Magnetic Field'.",NA
"http://qudt.org/vocab/unit/GAUGE_FR","French Gauge","http://qudt.org/vocab/dimensionvector/A0E0L1I0M0H0T0D0",0.0003333333,NA,NA
"http://qudt.org/vocab/unit/GAUSS","Gauss","http://qudt.org/vocab/dimensionvector/A0E-1L0I0M1H0T-2D0",1e-04,NA,NA
"http://qudt.org/vocab/unit/GI","Gilbert","http://qudt.org/vocab/dimensionvector/A0E1L0I0M0H0T0D0",0.795774715,NA,"The fundamental unit of magnetomotive force (\(mmf\)) in electromagnetic units is called a Gilbert. It is the \(mmf\) which will produce a magnetic field strength of one Gauss (Maxwell per Square Centimeter) in a path one centimeter long."
"http://qudt.org/vocab/unit/GI_UK","Gill (UK)","http://qudt.org/vocab/dimensionvector/A0E0L3I0M0H0T0D0",0.0001420653,NA,NA
"http://qudt.org/vocab/unit/GI_UK-PER-DAY","Gill (UK) Per Day","http://qudt.org/vocab/dimensionvector/A0E0L3I0M0H0T-1D0",1.644274e-09,NA,NA
"http://qudt.org/vocab/unit/GI_UK-PER-HR","Gill (UK) Per Hour","http://qudt.org/vocab/dimensionvector/A0E0L3I0M0H0T-1D0",3.946258e-08,NA,NA
"http://qudt.org/vocab/unit/GI_UK-PER-MIN","Gill (UK) Per Minute","http://qudt.org/vocab/dimensionvector/A0E0L3I0M0H0T-1D0",2.367755e-06,NA,NA
"http://qudt.org/vocab/unit/GI_UK-PER-SEC","Gill (UK) Per Second","http://qudt.org/vocab/dimensionvector/A0E0L3I0M0H0T-1D0",0.0001420653,NA,NA
"http://qudt.org/vocab/unit/GI_US","Gill (US)","http://qudt.org/vocab/dimensionvector/A0E0L3I0M0H0T0D0",0.000118294125,NA,NA
"http://qudt.org/vocab/unit/GI_US-PER-DAY","Gill (US) Per Day","http://qudt.org/vocab/dimensionvector/A0E0L3I0M0H0T-1D0",1.369145e-09,NA,NA
"http://qudt.org/vocab/unit/GI_US-PER-HR","Gill (US) Per Hour","http://qudt.org/vocab/dimensionvector/A0E0L3I0M0H0T-1D0",3.285947e-08,NA,NA
"http://qudt.org/vocab/unit/GI_US-PER-MIN","Gill (US) Per Minute","http://qudt.org/vocab/dimensionvector/A0E0L3I0M0H0T-1D0",1.971568e-06,NA,NA
"http://qudt.org/vocab/unit/GI_US-PER-SEC","Gill (US) Per Second","http://qudt.org/vocab/dimensionvector/A0E0L3I0M0H0T-1D0",0.0001182941,NA,NA
"http://qudt.org/vocab/unit/GibiBYTE","GibiByte","http://qudt.org/vocab/dimensionvector/A0E0L0I0M0H0T0D1",5954088943.63914,NA,"The gibibyte is a multiple of the unit byte for digital information storage. The prefix gibi means 1024^3"
"http://qudt.org/vocab/unit/GigaBasePair","Gigabase Pair","http://qudt.org/vocab/dimensionvector/A0E0L0I0M0H0T0D1",1e+09,NA,NA
"http://qudt.org/vocab/unit/GigaBIT-PER-SEC","Gigabit per Second","http://qudt.org/vocab/dimensionvector/A0E0L0I0M0H0T-1D0",693147180.559945,"A gigabit per second (Gbit/s or Gb/s) is a unit of data transfer rate equal to 1,000,000,000 bits per second.",NA
"http://qudt.org/vocab/unit/GigaBQ","Gigabecquerel","http://qudt.org/vocab/dimensionvector/A0E0L0I0M0H0T-1D0",1e+09,NA,NA
"http://qudt.org/vocab/unit/GigaBYTE","GigaByte","http://qudt.org/vocab/dimensionvector/A0E0L0I0M0H0T0D1",5545177444.47956,NA,"The gigabyte is a multiple of the unit byte for digital information storage. The prefix giga means 10 in the International System of Units (SI), therefore 1 gigabyte is \(1,000,000,000 \; bytes\). The unit symbol for the gigabyte is \(GB\) or \(Gbyte\), but not \(Gb\) (lower case b) which is typically used for the gigabit. Historically, the term has also been used in some fields of computer science and information technology to denote the \(gibibyte\), or \(1073741824 \; bytes\)."
"http://qudt.org/vocab/unit/GigaC","GigaCoulomb","http://qudt.org/vocab/dimensionvector/A0E1L0I0M0H0T1D0",1e+09,NA,NA
"http://qudt.org/vocab/unit/GigaC-PER-M3","Gigacoulomb Per Cubic Meter","http://qudt.org/vocab/dimensionvector/A0E0L1I0M0H0T-1D0",1e+09,NA,NA
"http://qudt.org/vocab/unit/GigaEV","Giga Electron Volt","http://qudt.org/vocab/dimensionvector/A0E0L2I0M1H0T-2D0",1.6021766e-10,NA,"""Giga Electron Volt"" is a unit for  'Energy And Work' expressed as \(GeV\)."
"http://qudt.org/vocab/unit/GigaHZ","Gigahertz","http://qudt.org/vocab/dimensionvector/A0E0L0I0M0H0T-1D0",1e+09,NA,"The hertz (symbol Hz) is the SI unit of frequency defined as the number of cycles per second of a periodic phenomenon. A GigaHertz is \(10^{9} hz\)."
"http://qudt.org/vocab/unit/GigaHZ-M","Gigahertz Meter","http://qudt.org/vocab/dimensionvector/A0E0L1I0M0H0T-1D0",1e+09,NA,NA
"http://qudt.org/vocab/unit/GigaJ","Gigajoule","http://qudt.org/vocab/dimensionvector/A0E0L2I0M1H0T-2D0",1e+09,NA,NA
"http://qudt.org/vocab/unit/GigaOHM","Gigaohm","http://qudt.org/vocab/dimensionvector/A0E-2L2I0M1H0T-3D0",1e+09,NA,NA
"http://qudt.org/vocab/unit/GigaPA","Gigapascal","http://qudt.org/vocab/dimensionvector/A0E0L-1I0M1H0T-2D0",1e+09,NA,NA
"http://qudt.org/vocab/unit/GigaW","Gigawatt","http://qudt.org/vocab/dimensionvector/A0E0L2I0M1H0T-3D0",1e+09,NA,NA
"http://qudt.org/vocab/unit/GigaW-HR","Gigawatt Hour","http://qudt.org/vocab/dimensionvector/A0E0L2I0M1H0T-2D0",3.6e+12,NA,NA
"http://qudt.org/vocab/unit/GM","Gram","http://qudt.org/vocab/dimensionvector/A0E0L0I0M1H0T0D0",0.001,"A unit of mass in the metric system. The name comes from the Greek gramma, a small weight identified in later Roman and Byzantine times with the Latin scripulum or scruple (the English scruple is equal to about 1.3 grams). The gram was originally defined to be the mass of one cubic centimeter of pure water, but to provide precise standards it was necessary to construct physical objects of specified mass. One gram is now defined to be 1/1000 of the mass of the standard kilogram, a platinum-iridium bar carefully guarded by the International Bureau of Weights and Measures in Paris for more than a century. (The kilogram, rather than the gram, is considered the base unit of mass in the SI.) The gram is a small mass, equal to about 15.432 grains or 0.035 273 966 ounce.",NA
"http://qudt.org/vocab/unit/GM-MilliM","Gram Millimeter","http://qudt.org/vocab/dimensionvector/A0E0L1I0M1H0T0D0",1e-06,NA,NA
"http://qudt.org/vocab/unit/GM-PER-CentiM2","Gram Per Square Centimeter","http://qudt.org/vocab/dimensionvector/A0E0L-2I0M1H0T0D0",10,NA,NA
"http://qudt.org/vocab/unit/GM-PER-CentiM2-YR","Grams per square centimetre per year","http://qudt.org/vocab/dimensionvector/A0E0L-2I0M1H0T-1D0",3.1688087814e-07,NA,NA
"http://qudt.org/vocab/unit/GM-PER-CentiM3","Gram Per Cubic Centimeter","http://qudt.org/vocab/dimensionvector/A0E0L-3I0M1H0T0D0",1000,NA,NA
"http://qudt.org/vocab/unit/GM-PER-DAY","Gram Per Day","http://qudt.org/vocab/dimensionvector/A0E0L0I0M1H0T-1D0",1.157407e-08,NA,NA
"http://qudt.org/vocab/unit/GM-PER-DeciM3","Gram Per Cubic Decimeter","http://qudt.org/vocab/dimensionvector/A0E0L-3I0M1H0T0D0",1,NA,NA
"http://qudt.org/vocab/unit/GM-PER-DEG_C","Gram Degree Celsius","http://qudt.org/vocab/dimensionvector/A0E0L0I0M1H1T0D0",NA,NA,"\(\textbf{Gram Degree Celsius} is a C.G.S System unit for 'Mass Temperature' expressed as \(g \cdot degC\)."
"http://qudt.org/vocab/unit/GM-PER-GM","Gram Per Gram","http://qudt.org/vocab/dimensionvector/A0E0L0I0M0H0T0D1",1,"mass ratio consisting of the 0.001-fold of the SI base unit kilogram divided by the 0.001-fold of the SI base unit kilogram.",NA
"http://qudt.org/vocab/unit/GM-PER-HR","Gram Per Hour","http://qudt.org/vocab/dimensionvector/A0E0L0I0M1H0T-1D0",2.777778e-07,NA,NA
"http://qudt.org/vocab/unit/GM-PER-KiloGM","Gram Per Kilogram","http://qudt.org/vocab/dimensionvector/A0E0L0I0M0H0T0D1",0.001,NA,NA
"http://qudt.org/vocab/unit/GM-PER-KiloM","Gram Per Kilometer","http://qudt.org/vocab/dimensionvector/A0E0L-1I0M1H0T0D0",1e-06,NA,NA
"http://qudt.org/vocab/unit/GM-PER-L","Gram Per Liter","http://qudt.org/vocab/dimensionvector/A0E0L-3I0M1H0T0D0",1,NA,NA
"http://qudt.org/vocab/unit/GM-PER-M","Gram Per Meter","http://qudt.org/vocab/dimensionvector/A0E0L-1I0M1H0T0D0",0.001,NA,NA
"http://qudt.org/vocab/unit/GM-PER-M2","Gram Per Square Meter","http://qudt.org/vocab/dimensionvector/A0E0L-2I0M1H0T0D0",0.001,NA,NA
"http://qudt.org/vocab/unit/GM-PER-M2-DAY","grams per square meter per day","http://qudt.org/vocab/dimensionvector/A0E0L-2I0M1H0T-1D0",1.1574073e-08,NA,NA
"http://qudt.org/vocab/unit/GM-PER-M3","Gram Per Cubic Meter","http://qudt.org/vocab/dimensionvector/A0E0L-3I0M1H0T0D0",0.001,NA,NA
"http://qudt.org/vocab/unit/GM-PER-MilliL","Gram Per Millilitre","http://qudt.org/vocab/dimensionvector/A0E0L-3I0M1H0T0D0",1000,NA,NA
"http://qudt.org/vocab/unit/GM-PER-MilliM","Gram Per Millimeter","http://qudt.org/vocab/dimensionvector/A0E0L-1I0M1H0T0D0",1,NA,NA
"http://qudt.org/vocab/unit/GM-PER-MIN","Gram Per Minute","http://qudt.org/vocab/dimensionvector/A0E0L0I0M1H0T-1D0",1.666667e-05,NA,NA
"http://qudt.org/vocab/unit/GM-PER-MOL","Gram Per Mole","http://qudt.org/vocab/dimensionvector/A-1E0L0I0M1H0T0D0",0.001,NA,NA
"http://qudt.org/vocab/unit/GM-PER-SEC","Gram Per Second","http://qudt.org/vocab/dimensionvector/A0E0L0I0M1H0T-1D0",0.001,NA,NA
"http://qudt.org/vocab/unit/GM_Carbon-PER-M2-DAY","grams Carbon per square meter per day","http://qudt.org/vocab/dimensionvector/A0E0L-2I0M1H0T-1D0",1.1574073e-08,NA,NA
"http://qudt.org/vocab/unit/GM_F","Gram Force","http://qudt.org/vocab/dimensionvector/A0E0L1I0M1H0T-2D0",0.00980665,NA,"""Gram Force"" is a unit for  'Force' expressed as \(gf\)."
"http://qudt.org/vocab/unit/GM_F-PER-CentiM2","Gram Force Per Square Centimeter","http://qudt.org/vocab/dimensionvector/A0E0L-1I0M1H0T-2D0",98.0665,NA,NA
"http://qudt.org/vocab/unit/GM_Nitrogen-PER-M2-DAY","grams Nitrogen per square meter per day","http://qudt.org/vocab/dimensionvector/A0E0L-2I0M1H0T-1D0",1.1574073e-08,NA,NA
"http://qudt.org/vocab/unit/GON","Gon","http://qudt.org/vocab/dimensionvector/A0E0L0I0M0H0T0D1",0.015707963267949,NA,"""Gon"" is a C.G.S System unit for  'Plane Angle' expressed as \(gon\)."
"http://qudt.org/vocab/unit/GR","Grade","http://qudt.org/vocab/dimensionvector/A0E0L0I0M0H0T0D1",NA,"the tangent of an angle of inclination multiplied by 100",NA
"http://qudt.org/vocab/unit/GRAD","Grad","http://qudt.org/vocab/dimensionvector/A0E0L0I0M0H0T0D1",0.0157079633,NA,"""Grad"" is a unit for  'Plane Angle' expressed as \(grad\)."
"http://qudt.org/vocab/unit/GRAIN","Grain","http://qudt.org/vocab/dimensionvector/A0E0L0I0M1H0T0D0",6.479891e-05,NA,"A grain is a unit of measurement of mass that is nominally based upon the mass of a single seed of a cereal.  The grain is the only unit of mass measure common to the three traditional English mass and weight systems; the obsolete Tower grain was, by definition, exactly  /64 of a troy grain. Since 1958, the grain or troy grain measure has been defined in terms of units of mass in the International System of Units as precisely 64.79891 milligrams. Thus, \(1 gram \approx 15.4323584 grains\).  There are precisely 7,000 grains per avoirdupois pound in the imperial and U.S. customary units, and 5,760 grains in the Troy pound."
"http://qudt.org/vocab/unit/GRAIN-PER-GAL","Grain per Gallon","http://qudt.org/vocab/dimensionvector/A0E0L-3I0M1H0T0D0",0.017118061,NA,"""Grain per Gallon"" is an Imperial unit for  'Density' expressed as \(gr/gal\)."
"http://qudt.org/vocab/unit/GRAIN-PER-GAL_US","Grain Per Gallon (US)","http://qudt.org/vocab/dimensionvector/A0E0L-3I0M1H0T0D0",0.01711806,NA,NA
"http://qudt.org/vocab/unit/GRAY","Gray","http://qudt.org/vocab/dimensionvector/A0E0L2I0M0H0T-2D0",1,"The SI unit of radiation dose. Radiation carries energy, and when it is absorbed by matter the matter receives this energy. The dose is the amount of energy deposited per unit of mass. One gray is defined to be the dose of one joule of energy absorbed per kilogram of matter, or 100 rad. The unit is named for the British physician L. Harold Gray (1905-1965), an authority on the use of radiation in the treatment of cancer.",NA
"http://qudt.org/vocab/unit/GRAY-PER-SEC","Gray per Second","http://qudt.org/vocab/dimensionvector/A0E0L2I0M0H0T-3D0",1,NA,"""Gray per Second"" is a unit for  'Absorbed Dose Rate' expressed as \(Gy/s\)."
"http://qudt.org/vocab/unit/Gs","Gs","http://qudt.org/vocab/dimensionvector/A0E-1L0I0M1H0T-2D0",1e-04,NA,"The gauss, abbreviated as \(G\), is the cgs unit of measurement of a magnetic field \(B\), which is also known as the ""magnetic flux density"" or the ""magnetic induction"".  One gauss is defined as one maxwell per square centimeter; it equals \(10^{-4} tesla\) (or \(100 micro T\)). The Gauss is identical to maxwells per square centimetre; technically defined in a three-dimensional system, it corresponds in the SI, with its extra base unit the ampere. The gauss is quite small by earthly standards, 1 Gs being only about four times Earth's flux density, but it is subdivided, with \(1 gauss = 105 gamma\). This unit of magnetic induction is also known as the \(\textit{abtesla}\)."
"http://qudt.org/vocab/unit/GT","Gross Tonnage","http://qudt.org/vocab/dimensionvector/A0E0L3I0M0H0T0D0",0,"The formula for calculating GT is given by \({ GT=V\times (0.2+0.02\times \log _{10}(V))}\)",NA
